Interval Start Time,Consumption Value,Demand Value,Date,interval,air_temp,dew_pt
2/1/16 12:00 AM,3.786,15.144,2016-02-01,0,2.80,-2.80
2/1/16 12:15 AM,3.66,14.64,2016-02-01,1,2.80,-2.80
2/1/16 12:30 AM,3.654,14.616,2016-02-01,2,2.50,-2.80
2/1/16 12:45 AM,3.888,15.552,2016-02-01,4,2.20,-2.80
2/1/16 1:00 AM,3.558,14.232,2016-02-01,0,1.93,-2.65
2/1/16 1:15 AM,4.44,17.76,2016-02-01,1,1.65,-2.50
2/1/16 1:30 AM,3.834,15.336,2016-02-01,2,1.38,-2.35
2/1/16 1:45 AM,3.798,15.192,2016-02-01,4,1.10,-2.20
2/1/16 2:00 AM,3.594,14.376,2016-02-01,0,0.98,-2.35
2/1/16 2:15 AM,3.888,15.552,2016-02-01,1,0.85,-2.50
2/1/16 2:30 AM,3.792,15.168,2016-02-01,2,0.73,-2.65
2/1/16 2:45 AM,3.75,15,2016-02-01,4,0.60,-2.80
2/1/16 3:00 AM,3.558,14.232,2016-02-01,0,0.45,-2.93
2/1/16 3:15 AM,3.864,15.456,2016-02-01,1,0.30,-3.05
2/1/16 3:30 AM,3.75,15,2016-02-01,2,0.15,-3.18
2/1/16 3:45 AM,3.666,14.664,2016-02-01,4,0.00,-3.30
2/1/16 4:00 AM,3.612,14.448,2016-02-01,0,-0.28,-3.30
2/1/16 4:15 AM,3.816,15.264,2016-02-01,1,-0.55,-3.30
2/1/16 4:30 AM,3.804,15.216,2016-02-01,2,-0.83,-3.30
2/1/16 4:45 AM,3.738,14.952,2016-02-01,4,-1.10,-3.30
2/1/16 5:00 AM,3.732,14.928,2016-02-01,0,-1.38,-3.45
2/1/16 5:15 AM,3.798,15.192,2016-02-01,1,-1.65,-3.60
2/1/16 5:30 AM,3.768,15.072,2016-02-01,2,-1.93,-3.75
2/1/16 5:45 AM,3.696,14.784,2016-02-01,4,-2.20,-3.90
2/1/16 6:00 AM,3.834,15.336,2016-02-01,0,-2.20,-3.90
2/1/16 6:15 AM,5.22,20.88,2016-02-01,1,-2.20,-3.90
2/1/16 6:30 AM,5.034,20.136,2016-02-01,2,-2.20,-3.90
2/1/16 6:45 AM,4.206,16.824,2016-02-01,4,-2.20,-3.90
2/1/16 7:00 AM,4.608,18.432,2016-02-01,0,-2.48,-4.03
2/1/16 7:15 AM,5.07,20.28,2016-02-01,1,-2.75,-4.15
2/1/16 7:30 AM,4.158,16.632,2016-02-01,2,-3.03,-4.28
2/1/16 7:45 AM,3.996,15.984,2016-02-01,4,-3.30,-4.40
2/1/16 8:00 AM,4.974,19.896,2016-02-01,0,-3.45,-4.55
2/1/16 8:15 AM,4.332,17.328,2016-02-01,1,-3.60,-4.70
2/1/16 8:30 AM,4.248,16.992,2016-02-01,2,-3.75,-4.85
2/1/16 8:45 AM,4.686,18.744,2016-02-01,4,-3.90,-5.00
2/1/16 9:00 AM,4.896,19.584,2016-02-01,0,-3.75,-4.85
2/1/16 9:15 AM,4.974,19.896,2016-02-01,1,-3.60,-4.70
2/1/16 9:30 AM,4.854,19.416,2016-02-01,2,-3.45,-4.55
2/1/16 9:45 AM,5.184,20.736,2016-02-01,4,-3.30,-4.40
2/1/16 10:00 AM,5.232,20.928,2016-02-01,0,-3.58,-4.70
2/1/16 10:15 AM,5.124,20.496,2016-02-01,1,-3.85,-5.00
2/1/16 10:30 AM,5.124,20.496,2016-02-01,2,-4.13,-5.30
2/1/16 10:45 AM,5.268,21.072,2016-02-01,4,-4.40,-5.60
2/1/16 11:00 AM,6.966,27.864,2016-02-01,0,-4.28,-5.60
2/1/16 11:15 AM,5.7,22.8,2016-02-01,1,-4.15,-5.60
2/1/16 11:30 AM,5.106,20.424,2016-02-01,2,-4.03,-5.60
2/1/16 11:45 AM,5.172,20.688,2016-02-01,4,-3.90,-5.60
2/1/16 12:00 PM,5.058,20.232,2016-02-01,0,-3.90,-5.60
2/1/16 12:15 PM,5.172,20.688,2016-02-01,1,-3.90,-5.60
2/1/16 12:30 PM,4.938,19.752,2016-02-01,2,-4.15,-5.60
2/1/16 12:45 PM,6.498,25.992,2016-02-01,4,-4.40,-5.60
2/1/16 1:00 PM,6.42,25.68,2016-02-01,0,-4.40,-5.60
2/1/16 1:15 PM,4.956,19.824,2016-02-01,1,-4.40,-5.60
2/1/16 1:30 PM,4.824,19.296,2016-02-01,2,-4.70,-5.85
2/1/16 1:45 PM,4.914,19.656,2016-02-01,4,-5.00,-6.10
2/1/16 1:45 PM,4.914,19.656,2016-02-01,4,-5.00,-6.10
2/1/16 2:00 PM,4.848,19.392,2016-02-01,0,-4.58,-5.68
2/1/16 2:15 PM,4.602,18.408,2016-02-01,1,-4.15,-5.25
2/1/16 2:30 PM,4.95,19.8,2016-02-01,2,-3.73,-4.83
2/1/16 2:45 PM,4.968,19.872,2016-02-01,4,-3.30,-4.40
2/1/16 3:00 PM,5.58,22.32,2016-02-01,0,-2.63,-3.85
2/1/16 3:15 PM,4.818,19.272,2016-02-01,1,-1.95,-3.30
2/1/16 3:30 PM,4.938,19.752,2016-02-01,2,-1.28,-2.75
2/1/16 3:45 PM,4.656,18.624,2016-02-01,4,-0.60,-2.20
2/1/16 4:00 PM,3.984,15.936,2016-02-01,0,-0.45,-2.20
2/1/16 4:15 PM,4.008,16.032,2016-02-01,1,-0.30,-2.20
2/1/16 4:30 PM,4.17,16.68,2016-02-01,2,-0.15,-2.20
2/1/16 4:45 PM,3.864,15.456,2016-02-01,4,0.00,-2.20
2/1/16 5:00 PM,4.272,17.088,2016-02-01,0,0.15,-2.08
2/1/16 5:15 PM,4.47,17.88,2016-02-01,1,0.30,-1.95
2/1/16 5:30 PM,4.158,16.632,2016-02-01,2,0.45,-1.83
2/1/16 5:45 PM,4.062,16.248,2016-02-01,4,0.60,-1.70
2/1/16 6:00 PM,4.128,16.512,2016-02-01,0,0.60,-1.70
2/1/16 6:15 PM,4.146,16.584,2016-02-01,1,0.60,-1.70
2/1/16 6:30 PM,4.116,16.464,2016-02-01,2,0.60,-1.70
2/1/16 6:45 PM,4.158,16.632,2016-02-01,4,0.60,-1.70
2/1/16 7:00 PM,4.218,16.872,2016-02-01,0,0.88,-1.70
2/1/16 7:15 PM,3.948,15.792,2016-02-01,1,1.15,-1.70
2/1/16 7:30 PM,4.038,16.152,2016-02-01,2,1.43,-1.70
2/1/16 7:45 PM,4.194,16.776,2016-02-01,4,1.70,-1.70
2/1/16 8:00 PM,4.044,16.176,2016-02-01,0,1.53,-2.03
2/1/16 8:15 PM,3.948,15.792,2016-02-01,1,1.35,-2.35
2/1/16 8:30 PM,4.008,16.032,2016-02-01,2,1.18,-2.68
2/1/16 8:45 PM,3.786,15.144,2016-02-01,4,1.00,-3.00
2/1/16 8:45 PM,3.786,15.144,2016-02-01,4,0.60,-2.20
2/1/16 9:00 PM,3.864,15.456,2016-02-01,0,0.85,-2.20
2/1/16 9:15 PM,3.294,13.176,2016-02-01,1,1.10,-2.20
2/1/16 9:30 PM,3.318,13.272,2016-02-01,2,-0.60,-2.80
2/1/16 9:45 PM,3.09,12.36,2016-02-01,4,-0.60,-3.30
2/1/16 9:45 PM,3.09,12.36,2016-02-01,4,-0.60,-3.30
2/1/16 10:00 PM,3.324,13.296,2016-02-01,0,-0.73,-3.45
2/1/16 10:15 PM,3.324,13.296,2016-02-01,1,-0.85,-3.60
2/1/16 10:30 PM,3.222,12.888,2016-02-01,2,-0.98,-3.75
2/1/16 10:45 PM,3.162,12.648,2016-02-01,4,-1.10,-3.90
2/1/16 11:00 PM,3.312,13.248,2016-02-01,0,-1.10,-3.90
2/1/16 11:15 PM,3.294,13.176,2016-02-01,1,-1.10,-3.90
2/1/16 11:30 PM,3.114,12.456,2016-02-01,2,-1.10,-3.90
2/1/16 11:45 PM,3.342,13.368,2016-02-01,4,-1.10,-3.90
2/2/16 12:00 AM,3.312,13.248,2016-02-02,0,-1.10,-3.90
2/2/16 12:15 AM,3.24,12.96,2016-02-02,1,-1.10,-3.90
2/2/16 12:30 AM,3.108,12.432,2016-02-02,2,-1.10,-3.90
2/2/16 12:45 AM,3.39,13.56,2016-02-02,4,-1.10,-3.90
2/2/16 1:00 AM,3.18,12.72,2016-02-02,0,-1.10,-3.90
2/2/16 1:15 AM,3.198,12.792,2016-02-02,1,-1.10,-3.90
2/2/16 1:30 AM,3.312,13.248,2016-02-02,2,-1.10,-3.90
2/2/16 1:45 AM,3.27,13.08,2016-02-02,4,-1.10,-3.90
2/2/16 2:00 AM,3.216,12.864,2016-02-02,0,-1.30,-4.07
2/2/16 2:15 AM,3.168,12.672,2016-02-02,1,-1.50,-4.23
2/2/16 2:30 AM,3.432,13.728,2016-02-02,2,-1.70,-4.40
2/2/16 2:45 AM,3.276,13.104,2016-02-02,4,-2.20,-5.00
2/2/16 3:00 AM,3.168,12.672,2016-02-02,0,-2.20,-5.00
2/2/16 3:15 AM,3.168,12.672,2016-02-02,1,-2.20,-5.00
2/2/16 3:30 AM,3.306,13.224,2016-02-02,2,-2.20,-5.00
2/2/16 3:45 AM,3.3,13.2,2016-02-02,4,-2.20,-5.00
2/2/16 4:00 AM,3.03,12.12,2016-02-02,0,-2.35,-5.00
2/2/16 4:15 AM,4.098,16.392,2016-02-02,1,-2.50,-5.00
2/2/16 4:30 AM,3.27,13.08,2016-02-02,2,-2.65,-5.00
2/2/16 4:45 AM,3.162,12.648,2016-02-02,4,-2.80,-5.00
2/2/16 5:00 AM,3.138,12.552,2016-02-02,0,-2.80,-5.00
2/2/16 5:15 AM,3.354,13.416,2016-02-02,1,-2.80,-5.00
2/2/16 5:30 AM,3.264,13.056,2016-02-02,2,-2.25,-5.00
2/2/16 5:45 AM,3.348,13.392,2016-02-02,4,-1.70,-5.00
2/2/16 6:00 AM,3.672,14.688,2016-02-02,0,-1.70,-5.00
2/2/16 6:15 AM,5.13,20.52,2016-02-02,1,-1.70,-5.00
2/2/16 6:30 AM,4.98,19.92,2016-02-02,2,-1.70,-5.00
2/2/16 6:45 AM,4.302,17.208,2016-02-02,4,-1.70,-5.00
2/2/16 7:00 AM,4.53,18.12,2016-02-02,0,-1.70,-5.15
2/2/16 7:15 AM,4.404,17.616,2016-02-02,1,-1.70,-5.30
2/2/16 7:30 AM,4.266,17.064,2016-02-02,2,-1.70,-5.45
2/2/16 7:45 AM,3.708,14.832,2016-02-02,4,-1.70,-5.60
2/2/16 8:00 AM,4.23,16.92,2016-02-02,0,-1.78,-5.70
2/2/16 8:15 AM,4.332,17.328,2016-02-02,1,-1.85,-5.80
2/2/16 8:30 AM,4.434,17.736,2016-02-02,2,-1.93,-5.90
2/2/16 8:45 AM,4.512,18.048,2016-02-02,4,-2.00,-6.00
2/2/16 8:45 AM,4.512,18.048,2016-02-02,4,-2.20,-6.10
2/2/16 9:00 AM,4.752,19.008,2016-02-02,0,-2.20,-5.85
2/2/16 9:15 AM,5.016,20.064,2016-02-02,1,-2.20,-5.60
2/2/16 9:30 AM,4.842,19.368,2016-02-02,2,-2.20,-5.60
2/2/16 9:45 AM,4.932,19.728,2016-02-02,4,-2.20,-5.60
2/2/16 10:00 AM,5.064,20.256,2016-02-02,0,-2.20,-5.60
2/2/16 10:15 AM,4.8,19.2,2016-02-02,1,-2.20,-5.60
2/2/16 10:30 AM,4.968,19.872,2016-02-02,2,-2.20,-5.60
2/2/16 10:45 AM,5.118,20.472,2016-02-02,4,-2.20,-5.60
2/2/16 11:00 AM,7.65,30.6,2016-02-02,0,-2.20,-5.60
2/2/16 11:15 AM,4.824,19.296,2016-02-02,1,-2.20,-5.60
2/2/16 11:30 AM,4.926,19.704,2016-02-02,2,-2.20,-5.60
2/2/16 11:45 AM,5.004,20.016,2016-02-02,4,-2.20,-5.60
2/2/16 12:00 PM,5.628,22.512,2016-02-02,0,-2.20,-5.60
2/2/16 12:15 PM,6.456,25.824,2016-02-02,1,-2.20,-5.60
2/2/16 12:30 PM,4.644,18.576,2016-02-02,2,-2.50,-5.30
2/2/16 12:45 PM,4.734,18.936,2016-02-02,4,-2.80,-5.00
2/2/16 1:00 PM,4.62,18.48,2016-02-02,0,-2.65,-5.15
2/2/16 1:15 PM,4.698,18.792,2016-02-02,1,-2.50,-5.30
2/2/16 1:30 PM,4.776,19.104,2016-02-02,2,-2.35,-5.45
2/2/16 1:45 PM,4.668,18.672,2016-02-02,4,-2.20,-5.60
2/2/16 2:00 PM,4.44,17.76,2016-02-02,0,-2.08,-5.73
2/2/16 2:15 PM,4.464,17.856,2016-02-02,1,-1.95,-5.85
2/2/16 2:30 PM,4.416,17.664,2016-02-02,2,-1.83,-5.98
2/2/16 2:45 PM,4.056,16.224,2016-02-02,4,-1.70,-6.10
2/2/16 3:00 PM,3.672,14.688,2016-02-02,0,-1.70,-6.10
2/2/16 3:15 PM,4.05,16.2,2016-02-02,1,-1.70,-6.10
2/2/16 3:30 PM,4.044,16.176,2016-02-02,2,-1.70,-6.10
2/2/16 3:45 PM,3.894,15.576,2016-02-02,4,-1.70,-6.10
2/2/16 4:00 PM,3.222,12.888,2016-02-02,0,-1.55,-6.10
2/2/16 4:15 PM,3.36,13.44,2016-02-02,1,-1.40,-6.10
2/2/16 4:30 PM,3.516,14.064,2016-02-02,2,-1.25,-6.10
2/2/16 4:45 PM,3.24,12.96,2016-02-02,4,-1.10,-6.10
2/2/16 5:00 PM,3.492,13.968,2016-02-02,0,-1.25,-5.68
2/2/16 5:15 PM,3.342,13.368,2016-02-02,1,-1.40,-5.25
2/2/16 5:30 PM,3.228,12.912,2016-02-02,2,-1.55,-4.83
2/2/16 5:45 PM,3.222,12.888,2016-02-02,4,-1.70,-4.40
2/2/16 5:45 PM,3.222,12.888,2016-02-02,4,-2.00,-4.00
2/2/16 6:00 PM,3.474,13.896,2016-02-02,0,-1.85,-4.20
2/2/16 6:15 PM,3.27,13.08,2016-02-02,1,-1.70,-4.40
2/2/16 6:15 PM,3.27,13.08,2016-02-02,1,-1.70,-3.90
2/2/16 6:15 PM,3.27,13.08,2016-02-02,1,-1.70,-3.90
2/2/16 6:30 PM,3.138,12.552,2016-02-02,2,-2.20,-3.90
2/2/16 6:30 PM,3.138,12.552,2016-02-02,2,-2.20,-3.90
2/2/16 6:45 PM,3.294,13.176,2016-02-02,4,-2.00,-3.00
2/2/16 6:45 PM,3.294,13.176,2016-02-02,4,-2.20,-3.30
2/2/16 7:00 PM,3.234,12.936,2016-02-02,0,-2.20,-3.30
2/2/16 7:15 PM,4.026,16.104,2016-02-02,1,-2.20,-3.30
2/2/16 7:30 PM,3.024,12.096,2016-02-02,2,-2.20,-3.30
2/2/16 7:45 PM,3.306,13.224,2016-02-02,4,-1.70,-3.30
2/2/16 7:45 PM,3.306,13.224,2016-02-02,4,-1.70,-3.30
2/2/16 8:00 PM,3.204,12.816,2016-02-02,0,-1.78,-3.23
2/2/16 8:15 PM,3.162,12.648,2016-02-02,1,-1.85,-3.15
2/2/16 8:30 PM,3.12,12.48,2016-02-02,2,-1.93,-3.08
2/2/16 8:45 PM,3.24,12.96,2016-02-02,4,-2.00,-3.00
2/2/16 8:45 PM,3.24,12.96,2016-02-02,4,-1.70,-3.30
2/2/16 9:00 PM,3.3,13.2,2016-02-02,0,-1.70,-3.18
2/2/16 9:15 PM,3.09,12.36,2016-02-02,1,-1.70,-3.05
2/2/16 9:30 PM,3.192,12.768,2016-02-02,2,-1.70,-2.93
2/2/16 9:45 PM,3.258,13.032,2016-02-02,4,-1.70,-2.80
2/2/16 10:00 PM,3.324,13.296,2016-02-02,0,-1.70,-2.97
2/2/16 10:15 PM,2.976,11.904,2016-02-02,1,-1.70,-3.13
2/2/16 10:30 PM,3.336,13.344,2016-02-02,2,-1.70,-3.30
2/2/16 10:45 PM,3.258,13.032,2016-02-02,4,-1.70,-3.30
2/2/16 10:45 PM,3.258,13.032,2016-02-02,4,-2.00,-3.00
2/2/16 10:45 PM,3.258,13.032,2016-02-02,4,-2.00,-3.00
2/2/16 11:00 PM,3.318,13.272,2016-02-02,0,-2.00,-3.25
2/2/16 11:15 PM,3.144,12.576,2016-02-02,1,-2.00,-3.50
2/2/16 11:30 PM,3.27,13.08,2016-02-02,2,-2.00,-3.75
2/2/16 11:45 PM,3.39,13.56,2016-02-02,4,-2.00,-4.00
2/2/16 11:45 PM,3.39,13.56,2016-02-02,4,-2.20,-3.90
2/2/16 11:45 PM,3.39,13.56,2016-02-02,4,-2.20,-3.90
2/3/16 12:00 AM,3.252,13.008,2016-02-03,0,-2.20,-3.90
2/3/16 12:15 AM,3.126,12.504,2016-02-03,1,-2.20,-3.90
2/3/16 12:15 AM,3.126,12.504,2016-02-03,1,-2.20,-3.90
2/3/16 12:30 AM,3.36,13.44,2016-02-03,2,-2.50,-4.15
2/3/16 12:45 AM,3.336,13.344,2016-02-03,4,-2.80,-4.40
2/3/16 1:00 AM,3.252,13.008,2016-02-03,0,-2.93,-4.55
2/3/16 1:15 AM,3.132,12.528,2016-02-03,1,-3.05,-4.70
2/3/16 1:30 AM,3.288,13.152,2016-02-03,2,-3.18,-4.85
2/3/16 1:45 AM,3.648,14.592,2016-02-03,4,-3.30,-5.00
2/3/16 1:45 AM,3.648,14.592,2016-02-03,4,-3.00,-5.00
2/3/16 2:00 AM,3.714,14.856,2016-02-03,0,-3.08,-5.00
2/3/16 2:15 AM,3.066,12.264,2016-02-03,1,-3.15,-5.00
2/3/16 2:30 AM,3.402,13.608,2016-02-03,2,-3.23,-5.00
2/3/16 2:45 AM,3.24,12.96,2016-02-03,4,-3.30,-5.00
2/3/16 3:00 AM,3.276,13.104,2016-02-03,0,-3.30,-5.00
2/3/16 3:15 AM,3.066,12.264,2016-02-03,1,-3.30,-5.00
2/3/16 3:30 AM,3.546,14.184,2016-02-03,2,-3.30,-5.00
2/3/16 3:30 AM,3.546,14.184,2016-02-03,2,-3.30,-5.00
2/3/16 3:45 AM,3.294,13.176,2016-02-03,4,-3.30,-5.00
2/3/16 4:00 AM,3.198,12.792,2016-02-03,0,-3.30,-5.20
2/3/16 4:15 AM,3.12,12.48,2016-02-03,1,-3.30,-5.40
2/3/16 4:30 AM,3.306,13.224,2016-02-03,2,-3.30,-5.60
2/3/16 4:45 AM,3.306,13.224,2016-02-03,4,-4.00,-6.00
2/3/16 4:45 AM,3.306,13.224,2016-02-03,4,-3.90,-5.60
2/3/16 5:00 AM,3.084,12.336,2016-02-03,0,-3.90,-5.85
2/3/16 5:15 AM,3.27,13.08,2016-02-03,1,-3.90,-6.10
2/3/16 5:30 AM,3.354,13.416,2016-02-03,2,-4.15,-6.40
2/3/16 5:45 AM,3.18,12.72,2016-02-03,4,-4.40,-6.70
2/3/16 6:00 AM,3.786,15.144,2016-02-03,0,-4.40,-6.70
2/3/16 6:15 AM,4.182,16.728,2016-02-03,1,-4.40,-6.70
2/3/16 6:30 AM,5.922,23.688,2016-02-03,2,-4.40,-7.20
2/3/16 6:45 AM,4.296,17.184,2016-02-03,4,-5.00,-7.20
2/3/16 7:00 AM,4.224,16.896,2016-02-03,0,-5.25,-7.40
2/3/16 7:15 AM,4.65,18.6,2016-02-03,1,-5.50,-7.60
2/3/16 7:30 AM,4.536,18.144,2016-02-03,2,-5.75,-7.80
2/3/16 7:45 AM,3.792,15.168,2016-02-03,4,-6.00,-8.00
2/3/16 7:45 AM,3.792,15.168,2016-02-03,4,-5.60,-7.80
2/3/16 8:00 AM,4.008,16.032,2016-02-03,0,-5.60,-7.80
2/3/16 8:15 AM,4.224,16.896,2016-02-03,1,-5.60,-7.80
2/3/16 8:30 AM,4.248,16.992,2016-02-03,2,-5.60,-7.80
2/3/16 8:45 AM,5.346,21.384,2016-02-03,4,-5.60,-8.30
2/3/16 9:00 AM,5.082,20.328,2016-02-03,0,-5.73,-8.45
2/3/16 9:15 AM,5.106,20.424,2016-02-03,1,-5.85,-8.60
2/3/16 9:30 AM,4.668,18.672,2016-02-03,2,-5.98,-8.75
2/3/16 9:45 AM,4.818,19.272,2016-02-03,4,-6.10,-8.90
2/3/16 10:00 AM,4.914,19.656,2016-02-03,0,-6.08,-8.93
2/3/16 10:15 AM,4.812,19.248,2016-02-03,1,-6.05,-8.95
2/3/16 10:30 AM,4.854,19.416,2016-02-03,2,-6.03,-8.98
2/3/16 10:45 AM,5.262,21.048,2016-02-03,4,-6.00,-9.00
2/3/16 10:45 AM,5.262,21.048,2016-02-03,4,-6.10,-8.90
2/3/16 11:00 AM,7.386,29.544,2016-02-03,0,-6.38,-9.03
2/3/16 11:15 AM,5.088,20.352,2016-02-03,1,-6.65,-9.15
2/3/16 11:30 AM,5.43,21.72,2016-02-03,2,-6.93,-9.28
2/3/16 11:45 AM,5.406,21.624,2016-02-03,4,-7.20,-9.40
2/3/16 12:00 PM,5.154,20.616,2016-02-03,0,-7.20,-9.40
2/3/16 12:15 PM,6.432,25.728,2016-02-03,1,-7.20,-9.40
2/3/16 12:30 PM,6.3,25.2,2016-02-03,2,-7.20,-9.70
2/3/16 12:45 PM,6.012,24.048,2016-02-03,4,-7.20,-10.00
2/3/16 12:45 PM,6.012,24.048,2016-02-03,4,-7.20,-10.00
2/3/16 1:00 PM,4.998,19.992,2016-02-03,0,-7.48,-10.28
2/3/16 1:15 PM,5.304,21.216,2016-02-03,1,-7.75,-10.55
2/3/16 1:30 PM,6.402,25.608,2016-02-03,2,-8.03,-10.83
2/3/16 1:45 PM,5.268,21.072,2016-02-03,4,-8.30,-11.10
2/3/16 1:45 PM,5.268,21.072,2016-02-03,4,-8.00,-11.00
2/3/16 2:00 PM,5.052,20.208,2016-02-03,0,-8.10,-11.03
2/3/16 2:15 PM,5.154,20.616,2016-02-03,1,-8.20,-11.07
2/3/16 2:30 PM,4.446,17.784,2016-02-03,2,-8.30,-11.10
2/3/16 2:45 PM,4.776,19.104,2016-02-03,4,-8.30,-11.10
2/3/16 3:00 PM,5.334,21.336,2016-02-03,0,-8.30,-11.25
2/3/16 3:15 PM,4.92,19.68,2016-02-03,1,-8.30,-11.40
2/3/16 3:30 PM,5.112,20.448,2016-02-03,2,-8.30,-11.55
2/3/16 3:45 PM,4.866,19.464,2016-02-03,4,-8.30,-11.70
2/3/16 4:00 PM,4.506,18.024,2016-02-03,0,-8.03,-11.83
2/3/16 4:15 PM,6.114,24.456,2016-02-03,1,-7.75,-11.95
2/3/16 4:30 PM,5.562,22.248,2016-02-03,2,-7.48,-12.08
2/3/16 4:45 PM,4.668,18.672,2016-02-03,4,-7.20,-12.20
2/3/16 5:00 PM,5.118,20.472,2016-02-03,0,-7.08,-12.48
2/3/16 5:15 PM,5.736,22.944,2016-02-03,1,-6.95,-12.75
2/3/16 5:30 PM,5.544,22.176,2016-02-03,2,-6.83,-13.03
2/3/16 5:45 PM,6.636,26.544,2016-02-03,4,-6.70,-13.30
2/3/16 6:00 PM,5.442,21.768,2016-02-03,0,-6.55,-13.45
2/3/16 6:15 PM,6.75,27,2016-02-03,1,-6.40,-13.60
2/3/16 6:30 PM,7.17,28.68,2016-02-03,2,-6.25,-13.75
2/3/16 6:45 PM,6.942,27.768,2016-02-03,4,-6.10,-13.90
2/3/16 7:00 PM,4.968,19.872,2016-02-03,0,-5.98,-14.18
2/3/16 7:15 PM,7.224,28.896,2016-02-03,1,-5.85,-14.45
2/3/16 7:30 PM,7.728,30.912,2016-02-03,2,-5.73,-14.73
2/3/16 7:45 PM,7.692,30.768,2016-02-03,4,-5.60,-15.00
2/3/16 8:00 PM,7.41,29.64,2016-02-03,0,-5.73,-14.85
2/3/16 8:15 PM,7.368,29.472,2016-02-03,1,-5.85,-14.70
2/3/16 8:30 PM,8.094,32.376,2016-02-03,2,-5.98,-14.55
2/3/16 8:45 PM,6.87,27.48,2016-02-03,4,-6.10,-14.40
2/3/16 9:00 PM,4.614,18.456,2016-02-03,0,-5.98,-14.40
2/3/16 9:15 PM,3.834,15.336,2016-02-03,1,-5.85,-14.40
2/3/16 9:30 PM,3.822,15.288,2016-02-03,2,-5.73,-14.40
2/3/16 9:45 PM,3.576,14.304,2016-02-03,4,-5.60,-14.40
2/3/16 10:00 PM,3.762,15.048,2016-02-03,0,-5.88,-14.55
2/3/16 10:15 PM,3.774,15.096,2016-02-03,1,-6.15,-14.70
2/3/16 10:30 PM,3.642,14.568,2016-02-03,2,-6.43,-14.85
2/3/16 10:45 PM,3.69,14.76,2016-02-03,4,-6.70,-15.00
2/3/16 11:00 PM,3.834,15.336,2016-02-03,0,-6.98,-14.85
2/3/16 11:15 PM,3.678,14.712,2016-02-03,1,-7.25,-14.70
2/3/16 11:30 PM,3.708,14.832,2016-02-03,2,-7.53,-14.55
2/3/16 11:45 PM,3.876,15.504,2016-02-03,4,-7.80,-14.40
2/4/16 12:00 AM,3.762,15.048,2016-02-04,0,-7.80,-14.40
2/4/16 12:15 AM,3.636,14.544,2016-02-04,1,-7.80,-14.40
2/4/16 12:30 AM,3.87,15.48,2016-02-04,2,-8.35,-14.70
2/4/16 12:45 AM,3.882,15.528,2016-02-04,4,-8.90,-15.00
2/4/16 1:00 AM,3.606,14.424,2016-02-04,0,-9.03,-15.00
2/4/16 1:15 AM,3.888,15.552,2016-02-04,1,-9.15,-15.00
2/4/16 1:30 AM,3.852,15.408,2016-02-04,2,-9.28,-15.00
2/4/16 1:45 AM,3.636,14.544,2016-02-04,4,-9.40,-15.00
2/4/16 2:00 AM,3.792,15.168,2016-02-04,0,-9.28,-15.00
2/4/16 2:15 AM,3.858,15.432,2016-02-04,1,-9.15,-15.00
2/4/16 2:30 AM,3.63,14.52,2016-02-04,2,-9.03,-15.00
2/4/16 2:45 AM,3.882,15.528,2016-02-04,4,-8.90,-15.00
2/4/16 3:00 AM,3.84,15.36,2016-02-04,0,-9.18,-14.85
2/4/16 3:15 AM,3.654,14.616,2016-02-04,1,-9.45,-14.70
2/4/16 3:30 AM,3.888,15.552,2016-02-04,2,-9.73,-14.55
2/4/16 3:45 AM,3.894,15.576,2016-02-04,4,-10.00,-14.40
2/4/16 4:00 AM,4.356,17.424,2016-02-04,0,-10.15,-14.40
2/4/16 4:15 AM,3.858,15.432,2016-02-04,1,-10.30,-14.40
2/4/16 4:30 AM,3.906,15.624,2016-02-04,2,-10.45,-14.40
2/4/16 4:45 AM,3.798,15.192,2016-02-04,4,-10.60,-14.40
2/4/16 5:00 AM,3.684,14.736,2016-02-04,0,-10.88,-14.40
2/4/16 5:15 AM,3.75,15,2016-02-04,1,-11.15,-14.40
2/4/16 5:30 AM,3.99,15.96,2016-02-04,2,-11.43,-14.40
2/4/16 5:45 AM,3.696,14.784,2016-02-04,4,-11.70,-14.40
2/4/16 6:00 AM,3.912,15.648,2016-02-04,0,-11.70,-14.40
2/4/16 6:15 AM,5.136,20.544,2016-02-04,1,-11.70,-14.40
2/4/16 6:30 AM,5.076,20.304,2016-02-04,2,-11.40,-14.15
2/4/16 6:45 AM,4.206,16.824,2016-02-04,4,-11.10,-13.90
2/4/16 7:00 AM,4.506,18.024,2016-02-04,0,-11.38,-14.03
2/4/16 7:15 AM,4.656,18.624,2016-02-04,1,-11.65,-14.15
2/4/16 7:30 AM,4.194,16.776,2016-02-04,2,-11.93,-14.28
2/4/16 7:45 AM,3.726,14.904,2016-02-04,4,-12.20,-14.40
2/4/16 8:00 AM,4.116,16.464,2016-02-04,0,-12.08,-14.28
2/4/16 8:15 AM,4.338,17.352,2016-02-04,1,-11.95,-14.15
2/4/16 8:30 AM,4.212,16.848,2016-02-04,2,-11.83,-14.03
2/4/16 8:45 AM,4.686,18.744,2016-02-04,4,-11.70,-13.90
2/4/16 9:00 AM,10.326,41.304,2016-02-04,0,-11.83,-14.03
2/4/16 9:15 AM,9.756,39.024,2016-02-04,1,-11.95,-14.15
2/4/16 9:30 AM,5.208,20.832,2016-02-04,2,-12.08,-14.28
2/4/16 9:45 AM,5.04,20.16,2016-02-04,4,-12.20,-14.40
2/4/16 10:00 AM,5.286,21.144,2016-02-04,0,-12.15,-14.30
2/4/16 10:15 AM,5.46,21.84,2016-02-04,1,-12.10,-14.20
2/4/16 10:30 AM,5.208,20.832,2016-02-04,2,-12.05,-14.10
2/4/16 10:45 AM,5.274,21.096,2016-02-04,4,-12.00,-14.00
2/4/16 10:45 AM,5.274,21.096,2016-02-04,4,-11.70,-13.90
2/4/16 11:00 AM,6.936,27.744,2016-02-04,0,-11.43,-13.63
2/4/16 11:15 AM,5.61,22.44,2016-02-04,1,-11.15,-13.35
2/4/16 11:30 AM,5.16,20.64,2016-02-04,2,-10.88,-13.08
2/4/16 11:45 AM,5.85,23.4,2016-02-04,4,-10.60,-12.80
2/4/16 12:00 PM,4.668,18.672,2016-02-04,0,-10.60,-12.80
2/4/16 12:15 PM,4.254,17.016,2016-02-04,1,-10.60,-12.80
2/4/16 12:30 PM,4.434,17.736,2016-02-04,2,-12.80,-14.40
2/4/16 12:45 PM,4.5,18,2016-02-04,4,-12.20,-14.40
2/4/16 1:00 PM,4.344,17.376,2016-02-04,0,-12.08,-14.28
2/4/16 1:15 PM,4.32,17.28,2016-02-04,1,-11.95,-14.15
2/4/16 1:30 PM,4.398,17.592,2016-02-04,2,-11.83,-14.03
2/4/16 1:45 PM,4.26,17.04,2016-02-04,4,-11.70,-13.90
2/4/16 2:00 PM,4.368,17.472,2016-02-04,0,-11.53,-13.43
2/4/16 2:15 PM,4.404,17.616,2016-02-04,1,-11.35,-12.95
2/4/16 2:30 PM,4.326,17.304,2016-02-04,2,-11.18,-12.48
2/4/16 2:45 PM,4.128,16.512,2016-02-04,4,-11.00,-12.00
2/4/16 2:45 PM,4.128,16.512,2016-02-04,4,-10.60,-12.20
2/4/16 3:00 PM,4.506,18.024,2016-02-04,0,-10.30,-11.95
2/4/16 3:15 PM,4.296,17.184,2016-02-04,1,-10.00,-11.70
2/4/16 3:15 PM,4.296,17.184,2016-02-04,1,-10.00,-11.70
2/4/16 3:30 PM,4.23,16.92,2016-02-04,2,-9.40,-11.10
2/4/16 3:45 PM,4.392,17.568,2016-02-04,4,-8.00,-9.00
2/4/16 3:45 PM,4.392,17.568,2016-02-04,4,-7.80,-9.40
2/4/16 4:00 PM,3.846,15.384,2016-02-04,0,-7.25,-9.28
2/4/16 4:15 PM,5.712,22.848,2016-02-04,1,-6.70,-9.15
2/4/16 4:30 PM,4.38,17.52,2016-02-04,2,-6.15,-9.03
2/4/16 4:45 PM,3.924,15.696,2016-02-04,4,-5.60,-8.90
2/4/16 5:00 PM,4.818,19.272,2016-02-04,0,-5.40,-8.53
2/4/16 5:15 PM,3.9,15.6,2016-02-04,1,-5.20,-8.17
2/4/16 5:30 PM,4.278,17.112,2016-02-04,2,-5.00,-7.80
2/4/16 5:30 PM,4.278,17.112,2016-02-04,2,-4.40,-7.80
2/4/16 5:45 PM,4.35,17.4,2016-02-04,4,-5.00,-8.00
2/4/16 5:45 PM,4.35,17.4,2016-02-04,4,-5.00,-7.80
2/4/16 6:00 PM,4.26,17.04,2016-02-04,0,-5.00,-7.80
2/4/16 6:15 PM,4.182,16.728,2016-02-04,1,-5.00,-7.80
2/4/16 6:30 PM,4.524,18.096,2016-02-04,2,-5.00,-7.80
2/4/16 6:45 PM,4.338,17.352,2016-02-04,4,-5.00,-8.00
2/4/16 6:45 PM,4.338,17.352,2016-02-04,4,-4.40,-7.80
2/4/16 7:00 PM,3.96,15.84,2016-02-04,0,-4.40,-7.80
2/4/16 7:15 PM,4.104,16.416,2016-02-04,1,-4.40,-7.80
2/4/16 7:30 PM,4.188,16.752,2016-02-04,2,-4.40,-7.80
2/4/16 7:45 PM,4.104,16.416,2016-02-04,4,-4.40,-7.80
2/4/16 8:00 PM,4.056,16.224,2016-02-04,0,-4.40,-7.80
2/4/16 8:15 PM,4.236,16.944,2016-02-04,1,-4.40,-7.80
2/4/16 8:30 PM,3.954,15.816,2016-02-04,2,-3.90,-7.80
2/4/16 8:45 PM,3.396,13.584,2016-02-04,4,-3.00,-7.00
2/4/16 8:45 PM,3.396,13.584,2016-02-04,4,-3.90,-7.20
2/4/16 8:45 PM,3.396,13.584,2016-02-04,4,-4.00,-7.00
2/4/16 9:00 PM,3.12,12.48,2016-02-04,0,-3.98,-7.20
2/4/16 9:15 PM,3.312,13.248,2016-02-04,1,-3.95,-7.40
2/4/16 9:30 PM,3.522,14.088,2016-02-04,2,-3.93,-7.60
2/4/16 9:45 PM,3.228,12.912,2016-02-04,4,-3.90,-7.80
2/4/16 10:00 PM,3.06,12.24,2016-02-04,0,-3.75,-8.08
2/4/16 10:15 PM,3.408,13.632,2016-02-04,1,-3.60,-8.35
2/4/16 10:30 PM,3.288,13.152,2016-02-04,2,-3.45,-8.63
2/4/16 10:45 PM,3.306,13.224,2016-02-04,4,-3.30,-8.90
2/4/16 11:00 PM,3.09,12.36,2016-02-04,0,-3.50,-9.27
2/4/16 11:15 PM,3.366,13.464,2016-02-04,1,-3.70,-9.63
2/4/16 11:30 PM,3.27,13.08,2016-02-04,2,-3.90,-10.00
2/4/16 11:45 PM,3.294,13.176,2016-02-04,4,-4.40,-10.60
2/5/16 12:00 AM,3.09,12.36,2016-02-05,0,-4.40,-10.60
2/5/16 12:15 AM,3.924,15.696,2016-02-05,1,-4.40,-10.60
2/5/16 12:30 AM,3.738,14.952,2016-02-05,2,-5.00,-10.60
2/5/16 12:45 AM,3.168,12.672,2016-02-05,4,-5.60,-10.60
2/5/16 1:00 AM,3.222,12.888,2016-02-05,0,-6.00,-10.73
2/5/16 1:15 AM,3.27,13.08,2016-02-05,1,-6.40,-10.85
2/5/16 1:30 AM,3.318,13.272,2016-02-05,2,-6.80,-10.98
2/5/16 1:45 AM,3.09,12.36,2016-02-05,4,-7.20,-11.10
2/5/16 2:00 AM,3.39,13.56,2016-02-05,0,-7.63,-11.38
2/5/16 2:15 AM,3.264,13.056,2016-02-05,1,-8.05,-11.65
2/5/16 2:30 AM,3.366,13.464,2016-02-05,2,-8.48,-11.93
2/5/16 2:45 AM,2.964,11.856,2016-02-05,4,-8.90,-12.20
2/5/16 3:00 AM,3.618,14.472,2016-02-05,0,-9.18,-12.20
2/5/16 3:15 AM,3.294,13.176,2016-02-05,1,-9.45,-12.20
2/5/16 3:30 AM,3.342,13.368,2016-02-05,2,-9.73,-12.20
2/5/16 3:45 AM,3.456,13.824,2016-02-05,4,-10.00,-12.20
2/5/16 4:00 AM,3.234,12.936,2016-02-05,0,-10.15,-12.48
2/5/16 4:15 AM,3.156,12.624,2016-02-05,1,-10.30,-12.75
2/5/16 4:30 AM,3.354,13.416,2016-02-05,2,-10.45,-13.03
2/5/16 4:45 AM,3.51,14.04,2016-02-05,4,-10.60,-13.30
2/5/16 5:00 AM,3.372,13.488,2016-02-05,0,-10.45,-13.30
2/5/16 5:15 AM,3.732,14.928,2016-02-05,1,-10.30,-13.30
2/5/16 5:30 AM,3.132,12.528,2016-02-05,2,-10.15,-13.30
2/5/16 5:45 AM,3.72,14.88,2016-02-05,4,-10.00,-13.30
2/5/16 6:00 AM,4.02,16.08,2016-02-05,0,-10.00,-13.30
2/5/16 6:15 AM,3.798,15.192,2016-02-05,1,-10.00,-13.30
2/5/16 6:30 AM,5.196,20.784,2016-02-05,2,-10.30,-13.60
2/5/16 6:45 AM,10.236,40.944,2016-02-05,4,-10.60,-13.90
2/5/16 7:00 AM,4.326,17.304,2016-02-05,0,-11.00,-13.90
2/5/16 7:15 AM,3.966,15.864,2016-02-05,1,-11.40,-13.90
2/5/16 7:30 AM,4.332,17.328,2016-02-05,2,-11.80,-13.90
2/5/16 7:45 AM,3.768,15.072,2016-02-05,4,-12.20,-13.90
2/5/16 8:00 AM,4.266,17.064,2016-02-05,0,-12.20,-13.90
2/5/16 8:15 AM,4.182,16.728,2016-02-05,1,-12.20,-13.90
2/5/16 8:30 AM,4.278,17.112,2016-02-05,2,-12.20,-13.90
2/5/16 8:45 AM,3.894,15.576,2016-02-05,4,-12.20,-13.90
2/5/16 9:00 AM,4.152,16.608,2016-02-05,0,-12.35,-14.03
2/5/16 9:15 AM,4.218,16.872,2016-02-05,1,-12.50,-14.15
2/5/16 9:30 AM,4.182,16.728,2016-02-05,2,-12.65,-14.28
2/5/16 9:45 AM,4.08,16.32,2016-02-05,4,-12.80,-14.40
2/5/16 10:00 AM,4.362,17.448,2016-02-05,0,-12.80,-14.40
2/5/16 10:15 AM,4.788,19.152,2016-02-05,1,-12.80,-14.40
2/5/16 10:30 AM,4.884,19.536,2016-02-05,2,-12.80,-14.40
2/5/16 10:45 AM,4.542,18.168,2016-02-05,4,-12.80,-14.40
2/5/16 11:00 AM,4.584,18.336,2016-02-05,0,-12.80,-14.55
2/5/16 11:15 AM,4.692,18.768,2016-02-05,1,-12.80,-14.70
2/5/16 11:30 AM,4.59,18.36,2016-02-05,2,-12.80,-14.85
2/5/16 11:45 AM,4.458,17.832,2016-02-05,4,-12.80,-15.00
2/5/16 12:00 PM,4.596,18.384,2016-02-05,0,-12.80,-15.00
2/5/16 12:15 PM,8.628,34.512,2016-02-05,1,-12.80,-15.00
2/5/16 12:30 PM,9.93,39.72,2016-02-05,2,-12.80,-14.70
2/5/16 12:45 PM,10.542,42.168,2016-02-05,4,-12.80,-14.40
2/5/16 1:00 PM,10.17,40.68,2016-02-05,0,-13.08,-14.55
2/5/16 1:15 PM,9.876,39.504,2016-02-05,1,-13.35,-14.70
2/5/16 1:30 PM,8.982,35.928,2016-02-05,2,-13.63,-14.85
2/5/16 1:45 PM,7.674,30.696,2016-02-05,4,-13.90,-15.00
2/5/16 2:00 PM,10.02,40.08,2016-02-05,0,-13.75,-15.00
2/5/16 2:15 PM,7.512,30.048,2016-02-05,1,-13.60,-15.00
2/5/16 2:30 PM,9.864,39.456,2016-02-05,2,-13.45,-15.00
2/5/16 2:45 PM,9.612,38.448,2016-02-05,4,-13.30,-15.00
2/5/16 3:00 PM,6.156,24.624,2016-02-05,0,-12.75,-14.58
2/5/16 3:15 PM,9.57,38.28,2016-02-05,1,-12.20,-14.15
2/5/16 3:30 PM,7.416,29.664,2016-02-05,2,-11.65,-13.73
2/5/16 3:45 PM,8.994,35.976,2016-02-05,4,-11.10,-13.30
2/5/16 4:00 PM,4.134,16.536,2016-02-05,0,-10.28,-12.75
2/5/16 4:15 PM,5.028,20.112,2016-02-05,1,-9.45,-12.20
2/5/16 4:30 PM,3.12,12.48,2016-02-05,2,-8.63,-11.65
2/5/16 4:45 PM,3.414,13.656,2016-02-05,4,-7.80,-11.10
2/5/16 5:00 PM,5.028,20.112,2016-02-05,0,-7.25,-10.83
2/5/16 5:15 PM,3.18,12.72,2016-02-05,1,-6.70,-10.55
2/5/16 5:30 PM,5.904,23.616,2016-02-05,2,-6.15,-10.28
2/5/16 5:45 PM,3.354,13.416,2016-02-05,4,-5.60,-10.00
2/5/16 6:00 PM,7.434,29.736,2016-02-05,0,-5.60,-10.00
2/5/16 6:15 PM,4.71,18.84,2016-02-05,1,-5.60,-10.00
2/5/16 6:30 PM,6.162,24.648,2016-02-05,2,-4.75,-9.45
2/5/16 6:45 PM,7.008,28.032,2016-02-05,4,-3.90,-8.90
2/5/16 7:00 PM,3.882,15.528,2016-02-05,0,-3.63,-8.90
2/5/16 7:15 PM,5.292,21.168,2016-02-05,1,-3.35,-8.90
2/5/16 7:30 PM,3.87,15.48,2016-02-05,2,-3.08,-8.90
2/5/16 7:45 PM,3.264,13.056,2016-02-05,4,-2.80,-8.90
2/5/16 8:00 PM,3.318,13.272,2016-02-05,0,-2.65,-9.18
2/5/16 8:15 PM,2.988,11.952,2016-02-05,1,-2.50,-9.45
2/5/16 8:30 PM,4.812,19.248,2016-02-05,2,-2.35,-9.73
2/5/16 8:45 PM,6.03,24.12,2016-02-05,4,-2.20,-10.00
2/5/16 9:00 PM,5.862,23.448,2016-02-05,0,-2.20,-10.28
2/5/16 9:15 PM,4.032,16.128,2016-02-05,1,-2.20,-10.55
2/5/16 9:30 PM,3.318,13.272,2016-02-05,2,-2.20,-10.83
2/5/16 9:45 PM,2.946,11.784,2016-02-05,4,-2.20,-11.10
2/5/16 10:00 PM,3.24,12.96,2016-02-05,0,-2.48,-10.55
2/5/16 10:15 PM,3.186,12.744,2016-02-05,1,-2.75,-10.00
2/5/16 10:30 PM,3.144,12.576,2016-02-05,2,-3.03,-9.45
2/5/16 10:45 PM,2.994,11.976,2016-02-05,4,-3.30,-8.90
2/5/16 11:00 PM,3.306,13.224,2016-02-05,0,-3.30,-8.53
2/5/16 11:15 PM,3.216,12.864,2016-02-05,1,-3.30,-8.17
2/5/16 11:30 PM,3.09,12.36,2016-02-05,2,-3.30,-7.80
2/5/16 11:45 PM,3.192,12.768,2016-02-05,4,-3.90,-7.80
2/6/16 12:00 AM,3.324,13.296,2016-02-06,0,-3.90,-7.80
2/6/16 12:15 AM,3.126,12.504,2016-02-06,1,-3.90,-7.80
2/6/16 12:30 AM,3.096,12.384,2016-02-06,2,-3.90,-7.50
2/6/16 12:45 AM,3.444,13.776,2016-02-06,4,-3.90,-7.20
2/6/16 1:00 AM,3.264,13.056,2016-02-06,0,-3.90,-7.20
2/6/16 1:15 AM,3.054,12.216,2016-02-06,1,-3.90,-7.20
2/6/16 1:30 AM,3.216,12.864,2016-02-06,2,-3.90,-7.20
2/6/16 1:45 AM,3.264,13.056,2016-02-06,4,-3.90,-7.20
2/6/16 2:00 AM,3.09,12.36,2016-02-06,0,-3.90,-7.20
2/6/16 2:15 AM,3.15,12.6,2016-02-06,1,-3.90,-7.20
2/6/16 2:30 AM,4.032,16.128,2016-02-06,2,-3.90,-6.95
2/6/16 2:45 AM,3.018,12.072,2016-02-06,4,-3.90,-6.70
2/6/16 3:00 AM,3.216,12.864,2016-02-06,0,-3.75,-6.55
2/6/16 3:15 AM,3.294,13.176,2016-02-06,1,-3.60,-6.40
2/6/16 3:30 AM,3.156,12.624,2016-02-06,2,-3.45,-6.25
2/6/16 3:45 AM,3.108,12.432,2016-02-06,4,-3.30,-6.10
2/6/16 4:00 AM,3.432,13.728,2016-02-06,0,-3.30,-6.10
2/6/16 4:15 AM,3.318,13.272,2016-02-06,1,-3.30,-6.10
2/6/16 4:30 AM,3.12,12.48,2016-02-06,2,-3.30,-6.10
2/6/16 4:45 AM,3.24,12.96,2016-02-06,4,-3.30,-6.10
2/6/16 5:00 AM,3.318,13.272,2016-02-06,0,-3.30,-6.10
2/6/16 5:15 AM,3.282,13.128,2016-02-06,1,-3.30,-6.10
2/6/16 5:30 AM,3.18,12.72,2016-02-06,2,-3.30,-6.10
2/6/16 5:45 AM,3.204,12.816,2016-02-06,4,-3.30,-6.10
2/6/16 6:00 AM,3.378,13.512,2016-02-06,0,-3.30,-6.10
2/6/16 6:15 AM,3.714,14.856,2016-02-06,1,-3.30,-6.10
2/6/16 6:30 AM,3.468,13.872,2016-02-06,2,-3.30,-6.10
2/6/16 6:45 AM,3.624,14.496,2016-02-06,4,-3.30,-6.10
2/6/16 7:00 AM,3.732,14.928,2016-02-06,0,-3.30,-5.98
2/6/16 7:15 AM,3.768,15.072,2016-02-06,1,-3.30,-5.85
2/6/16 7:30 AM,3.606,14.424,2016-02-06,2,-3.30,-5.73
2/6/16 7:45 AM,3.936,15.744,2016-02-06,4,-3.30,-5.60
2/6/16 8:00 AM,4.326,17.304,2016-02-06,0,-3.45,-5.73
2/6/16 8:15 AM,4.14,16.56,2016-02-06,1,-3.60,-5.85
2/6/16 8:30 AM,4.782,19.128,2016-02-06,2,-3.75,-5.98
2/6/16 8:45 AM,4.104,16.416,2016-02-06,4,-3.90,-6.10
2/6/16 9:00 AM,4.11,16.44,2016-02-06,0,-3.90,-6.25
2/6/16 9:15 AM,4.062,16.248,2016-02-06,1,-3.90,-6.40
2/6/16 9:30 AM,3.846,15.384,2016-02-06,2,-3.90,-6.55
2/6/16 9:45 AM,4.176,16.704,2016-02-06,4,-3.90,-6.70
2/6/16 10:00 AM,3.966,15.864,2016-02-06,0,-3.90,-6.55
2/6/16 10:15 AM,4.158,16.632,2016-02-06,1,-3.90,-6.40
2/6/16 10:30 AM,3.9,15.6,2016-02-06,2,-3.90,-6.25
2/6/16 10:45 AM,4.32,17.28,2016-02-06,4,-3.90,-6.10
2/6/16 11:00 AM,4.254,17.016,2016-02-06,0,-3.75,-6.10
2/6/16 11:15 AM,4.116,16.464,2016-02-06,1,-3.60,-6.10
2/6/16 11:30 AM,4.026,16.104,2016-02-06,2,-3.45,-6.10
2/6/16 11:45 AM,4.122,16.488,2016-02-06,4,-3.30,-6.10
2/6/16 12:00 PM,4.236,16.944,2016-02-06,0,-3.30,-6.10
2/6/16 12:15 PM,4.266,17.064,2016-02-06,1,-3.30,-6.10
2/6/16 12:30 PM,4.068,16.272,2016-02-06,2,-3.30,-5.85
2/6/16 12:45 PM,4.398,17.592,2016-02-06,4,-3.30,-5.60
2/6/16 1:00 PM,4.194,16.776,2016-02-06,0,-3.30,-5.60
2/6/16 1:15 PM,3.972,15.888,2016-02-06,1,-3.30,-5.60
2/6/16 1:30 PM,3.912,15.648,2016-02-06,2,-3.30,-5.60
2/6/16 1:45 PM,3.966,15.864,2016-02-06,4,-3.30,-5.60
2/6/16 2:00 PM,3.882,15.528,2016-02-06,0,-3.30,-5.45
2/6/16 2:15 PM,3.666,14.664,2016-02-06,1,-3.30,-5.30
2/6/16 2:30 PM,3.504,14.016,2016-02-06,2,-3.30,-5.15
2/6/16 2:45 PM,3.612,14.448,2016-02-06,4,-3.30,-5.00
2/6/16 3:00 PM,3.294,13.176,2016-02-06,0,-3.13,-5.00
2/6/16 3:15 PM,3.522,14.088,2016-02-06,1,-2.97,-5.00
2/6/16 3:30 PM,3.636,14.544,2016-02-06,2,-2.80,-5.00
2/6/16 3:45 PM,3.498,13.992,2016-02-06,4,-2.20,-4.40
2/6/16 4:00 PM,3.396,13.584,2016-02-06,0,-1.93,-4.40
2/6/16 4:15 PM,3.552,14.208,2016-02-06,1,-1.65,-4.40
2/6/16 4:30 PM,3.744,14.976,2016-02-06,2,-1.38,-4.40
2/6/16 4:45 PM,2.904,11.616,2016-02-06,4,-1.10,-4.40
2/6/16 5:00 PM,3.15,12.6,2016-02-06,0,-0.68,-4.28
2/6/16 5:15 PM,3.228,12.912,2016-02-06,1,-0.25,-4.15
2/6/16 5:30 PM,2.736,10.944,2016-02-06,2,0.18,-4.03
2/6/16 5:45 PM,3.156,12.624,2016-02-06,4,0.60,-3.90
2/6/16 6:00 PM,3.126,12.504,2016-02-06,0,0.60,-3.90
2/6/16 6:15 PM,3.03,12.12,2016-02-06,1,0.60,-3.90
2/6/16 6:30 PM,2.856,11.424,2016-02-06,2,1.15,-3.90
2/6/16 6:45 PM,3.24,12.96,2016-02-06,4,1.70,-3.90
2/6/16 7:00 PM,3.108,12.432,2016-02-06,0,1.83,-3.75
2/6/16 7:15 PM,2.934,11.736,2016-02-06,1,1.95,-3.60
2/6/16 7:30 PM,3.168,12.672,2016-02-06,2,2.08,-3.45
2/6/16 7:45 PM,3.174,12.696,2016-02-06,4,2.20,-3.30
2/6/16 8:00 PM,3.126,12.504,2016-02-06,0,2.20,-3.30
2/6/16 8:15 PM,2.952,11.808,2016-02-06,1,2.20,-3.30
2/6/16 8:30 PM,3.21,12.84,2016-02-06,2,2.20,-3.30
2/6/16 8:45 PM,3.192,12.768,2016-02-06,4,2.20,-3.30
2/6/16 9:00 PM,2.946,11.784,2016-02-06,0,2.08,-3.45
2/6/16 9:15 PM,3.114,12.456,2016-02-06,1,1.95,-3.60
2/6/16 9:30 PM,3.198,12.792,2016-02-06,2,1.83,-3.75
2/6/16 9:45 PM,3.138,12.552,2016-02-06,4,1.70,-3.90
2/6/16 10:00 PM,2.916,11.664,2016-02-06,0,1.70,-3.75
2/6/16 10:15 PM,3.27,13.08,2016-02-06,1,1.70,-3.60
2/6/16 10:30 PM,3.186,12.744,2016-02-06,2,1.70,-3.45
2/6/16 10:45 PM,3,12,2016-02-06,4,1.70,-3.30
2/6/16 11:00 PM,3.132,12.528,2016-02-06,0,1.70,-3.30
2/6/16 11:15 PM,3.192,12.768,2016-02-06,1,1.70,-3.30
2/6/16 11:30 PM,3.936,15.744,2016-02-06,2,1.70,-3.30
2/6/16 11:45 PM,3.018,12.072,2016-02-06,4,1.70,-3.30
2/7/16 12:00 AM,3.276,13.104,2016-02-07,0,1.70,-3.30
2/7/16 12:15 AM,3.156,12.624,2016-02-07,1,1.70,-3.30
2/7/16 12:30 AM,3.024,12.096,2016-02-07,2,1.95,-3.30
2/7/16 12:45 AM,3.18,12.72,2016-02-07,4,2.20,-3.30
2/7/16 1:00 AM,3.21,12.84,2016-02-07,0,2.20,-3.18
2/7/16 1:15 AM,3.054,12.216,2016-02-07,1,2.20,-3.05
2/7/16 1:30 AM,2.994,11.976,2016-02-07,2,2.20,-2.93
2/7/16 1:45 AM,3.234,12.936,2016-02-07,4,2.20,-2.80
2/7/16 2:00 AM,3.162,12.648,2016-02-07,0,2.08,-2.65
2/7/16 2:15 AM,2.952,11.808,2016-02-07,1,1.95,-2.50
2/7/16 2:30 AM,3.126,12.504,2016-02-07,2,1.83,-2.35
2/7/16 2:45 AM,3.222,12.888,2016-02-07,4,1.70,-2.20
2/7/16 3:00 AM,3.054,12.216,2016-02-07,0,1.70,-2.20
2/7/16 3:15 AM,3.042,12.168,2016-02-07,1,1.70,-2.20
2/7/16 3:30 AM,3.222,12.888,2016-02-07,2,1.70,-2.20
2/7/16 3:45 AM,3.108,12.432,2016-02-07,4,1.70,-2.20
2/7/16 4:00 AM,3,12,2016-02-07,0,1.70,-2.20
2/7/16 4:15 AM,3.102,12.408,2016-02-07,1,1.70,-2.20
2/7/16 4:30 AM,3.252,13.008,2016-02-07,2,1.70,-2.20
2/7/16 4:45 AM,3.048,12.192,2016-02-07,4,1.70,-2.20
2/7/16 5:00 AM,3.21,12.84,2016-02-07,0,1.70,-2.20
2/7/16 5:15 AM,3.228,12.912,2016-02-07,1,1.70,-2.20
2/7/16 5:15 AM,3.228,12.912,2016-02-07,1,1.70,-2.20
2/7/16 5:30 AM,3.204,12.816,2016-02-07,2,1.70,-2.50
2/7/16 5:45 AM,3.132,12.528,2016-02-07,4,1.70,-2.80
2/7/16 6:00 AM,3.684,14.736,2016-02-07,0,1.70,-2.80
2/7/16 6:15 AM,3.468,13.872,2016-02-07,1,1.70,-2.80
2/7/16 6:30 AM,3.666,14.664,2016-02-07,2,1.40,-2.80
2/7/16 6:45 AM,3.582,14.328,2016-02-07,4,1.10,-2.80
2/7/16 7:00 AM,4.338,17.352,2016-02-07,0,0.98,-2.80
2/7/16 7:15 AM,3.846,15.384,2016-02-07,1,0.85,-2.80
2/7/16 7:30 AM,3.534,14.136,2016-02-07,2,0.73,-2.80
2/7/16 7:45 AM,3.426,13.704,2016-02-07,4,0.60,-2.80
2/7/16 8:00 AM,3.762,15.048,2016-02-07,0,0.60,-2.80
2/7/16 8:15 AM,5.25,21,2016-02-07,1,0.60,-2.80
2/7/16 8:30 AM,6.132,24.528,2016-02-07,2,0.60,-2.80
2/7/16 8:45 AM,4.74,18.96,2016-02-07,4,0.60,-2.80
2/7/16 9:00 AM,6.726,26.904,2016-02-07,0,0.30,-2.93
2/7/16 9:15 AM,7.314,29.256,2016-02-07,1,0.00,-3.05
2/7/16 9:30 AM,7.428,29.712,2016-02-07,2,-0.30,-3.18
2/7/16 9:45 AM,7.122,28.488,2016-02-07,4,-0.60,-3.30
2/7/16 10:00 AM,8.214,32.856,2016-02-07,0,-0.30,-3.18
2/7/16 10:15 AM,7.164,28.656,2016-02-07,1,0.00,-3.05
2/7/16 10:30 AM,8.322,33.288,2016-02-07,2,0.30,-2.93
2/7/16 10:45 AM,6.828,27.312,2016-02-07,4,0.60,-2.80
2/7/16 11:00 AM,6.762,27.048,2016-02-07,0,0.73,-2.65
2/7/16 11:15 AM,7.032,28.128,2016-02-07,1,0.85,-2.50
2/7/16 11:30 AM,7.014,28.056,2016-02-07,2,0.98,-2.35
2/7/16 11:45 AM,6.672,26.688,2016-02-07,4,1.10,-2.20
2/7/16 12:00 PM,7.002,28.008,2016-02-07,0,1.10,-2.20
2/7/16 12:15 PM,6.996,27.984,2016-02-07,1,1.10,-2.20
2/7/16 12:30 PM,6.606,26.424,2016-02-07,2,1.95,-2.20
2/7/16 12:45 PM,6.774,27.096,2016-02-07,4,2.80,-2.20
2/7/16 1:00 PM,6.558,26.232,2016-02-07,0,2.80,-2.35
2/7/16 1:15 PM,6.372,25.488,2016-02-07,1,2.80,-2.50
2/7/16 1:30 PM,6.414,25.656,2016-02-07,2,2.80,-2.65
2/7/16 1:45 PM,6.558,26.232,2016-02-07,4,2.80,-2.80
2/7/16 2:00 PM,6.582,26.328,2016-02-07,0,2.80,-2.93
2/7/16 2:15 PM,5.04,20.16,2016-02-07,1,2.80,-3.05
2/7/16 2:30 PM,4.29,17.16,2016-02-07,2,2.80,-3.18
2/7/16 2:45 PM,3.654,14.616,2016-02-07,4,2.80,-3.30
2/7/16 3:00 PM,3.33,13.32,2016-02-07,0,3.08,-3.30
2/7/16 3:15 PM,3.36,13.44,2016-02-07,1,3.35,-3.30
2/7/16 3:30 PM,3.504,14.016,2016-02-07,2,3.63,-3.30
2/7/16 3:45 PM,3.276,13.104,2016-02-07,4,3.90,-3.30
2/7/16 4:00 PM,2.742,10.968,2016-02-07,0,3.90,-3.45
2/7/16 4:15 PM,2.898,11.592,2016-02-07,1,3.90,-3.60
2/7/16 4:30 PM,2.904,11.616,2016-02-07,2,3.90,-3.75
2/7/16 4:45 PM,2.778,11.112,2016-02-07,4,3.90,-3.90
2/7/16 5:00 PM,3.198,12.792,2016-02-07,0,4.03,-3.90
2/7/16 5:15 PM,3.054,12.216,2016-02-07,1,4.15,-3.90
2/7/16 5:30 PM,2.868,11.472,2016-02-07,2,4.28,-3.90
2/7/16 5:45 PM,3.192,12.768,2016-02-07,4,4.40,-3.90
2/7/16 6:00 PM,3.108,12.432,2016-02-07,0,4.40,-3.90
2/7/16 6:15 PM,2.988,11.952,2016-02-07,1,4.40,-3.90
2/7/16 6:30 PM,3.084,12.336,2016-02-07,2,4.15,-3.60
2/7/16 6:45 PM,3.282,13.128,2016-02-07,4,3.90,-3.30
2/7/16 7:00 PM,2.916,11.664,2016-02-07,0,3.90,-3.18
2/7/16 7:15 PM,3.144,12.576,2016-02-07,1,3.90,-3.05
2/7/16 7:30 PM,3.096,12.384,2016-02-07,2,3.90,-2.93
2/7/16 7:45 PM,3.12,12.48,2016-02-07,4,3.90,-2.80
2/7/16 8:00 PM,3.054,12.216,2016-02-07,0,3.75,-2.65
2/7/16 8:15 PM,3.348,13.392,2016-02-07,1,3.60,-2.50
2/7/16 8:30 PM,2.988,11.952,2016-02-07,2,3.45,-2.35
2/7/16 8:45 PM,3.246,12.984,2016-02-07,4,3.30,-2.20
2/7/16 9:00 PM,3.204,12.816,2016-02-07,0,3.30,-2.20
2/7/16 9:15 PM,3.402,13.608,2016-02-07,1,3.30,-2.20
2/7/16 9:30 PM,2.922,11.688,2016-02-07,2,3.05,-1.95
2/7/16 9:45 PM,3.354,13.416,2016-02-07,4,2.80,-1.70
2/7/16 10:00 PM,4.026,16.104,2016-02-07,0,2.80,-1.55
2/7/16 10:15 PM,3.18,12.72,2016-02-07,1,2.80,-1.40
2/7/16 10:30 PM,3.24,12.96,2016-02-07,2,2.80,-1.25
2/7/16 10:45 PM,3.342,13.368,2016-02-07,4,2.80,-1.10
2/7/16 11:00 PM,3.258,13.032,2016-02-07,0,2.23,-1.83
2/7/16 11:15 PM,3.114,12.456,2016-02-07,1,1.67,-2.57
2/7/16 11:30 PM,3.432,13.728,2016-02-07,2,1.10,-3.30
2/7/16 11:45 PM,3.288,13.152,2016-02-07,4,0.60,-5.60
2/8/16 12:00 AM,3.42,13.68,2016-02-08,0,0.60,-5.60
2/8/16 12:15 AM,3.246,12.984,2016-02-08,1,0.60,-5.60
2/8/16 12:30 AM,3.414,13.656,2016-02-08,2,-1.10,-5.60
2/8/16 12:45 AM,3.054,12.216,2016-02-08,4,-2.80,-5.60
2/8/16 12:45 AM,3.054,12.216,2016-02-08,4,-2.20,-6.10
2/8/16 1:00 AM,3.24,12.96,2016-02-08,0,-2.50,-5.85
2/8/16 1:15 AM,3.246,12.984,2016-02-08,1,-2.80,-5.60
2/8/16 1:15 AM,3.246,12.984,2016-02-08,1,-3.30,-5.60
2/8/16 1:30 AM,3.282,13.128,2016-02-08,2,-4.40,-7.20
2/8/16 1:30 AM,3.282,13.128,2016-02-08,2,-3.90,-6.10
2/8/16 1:45 AM,3.09,12.36,2016-02-08,4,-5.00,-7.80
2/8/16 1:45 AM,3.09,12.36,2016-02-08,4,-4.00,-8.00
2/8/16 1:45 AM,3.09,12.36,2016-02-08,4,-4.40,-7.80
2/8/16 2:00 AM,3.474,13.896,2016-02-08,0,-4.80,-7.97
2/8/16 2:15 AM,3.354,13.416,2016-02-08,1,-5.20,-8.13
2/8/16 2:30 AM,3.432,13.728,2016-02-08,2,-5.60,-8.30
2/8/16 2:45 AM,3.114,12.456,2016-02-08,4,-6.70,-11.10
2/8/16 3:00 AM,3.312,13.248,2016-02-08,0,-7.03,-11.33
2/8/16 3:15 AM,3.336,13.344,2016-02-08,1,-7.35,-11.55
2/8/16 3:30 AM,3.168,12.672,2016-02-08,2,-7.68,-11.78
2/8/16 3:45 AM,3.216,12.864,2016-02-08,4,-8.00,-12.00
2/8/16 3:45 AM,3.216,12.864,2016-02-08,4,-7.80,-12.20
2/8/16 4:00 AM,3.426,13.704,2016-02-08,0,-7.80,-12.40
2/8/16 4:15 AM,3.27,13.08,2016-02-08,1,-7.80,-12.60
2/8/16 4:30 AM,3.21,12.84,2016-02-08,2,-7.80,-12.80
2/8/16 4:45 AM,3.498,13.992,2016-02-08,4,-8.30,-13.30
2/8/16 5:00 AM,7.296,29.184,2016-02-08,0,-8.45,-13.30
2/8/16 5:15 AM,8.658,34.632,2016-02-08,1,-8.60,-13.30
2/8/16 5:30 AM,3.234,12.936,2016-02-08,2,-8.75,-13.30
2/8/16 5:45 AM,3.588,14.352,2016-02-08,4,-8.90,-13.30
2/8/16 6:00 AM,3.93,15.72,2016-02-08,0,-8.90,-13.30
2/8/16 6:15 AM,5.598,22.392,2016-02-08,1,-8.90,-13.30
2/8/16 6:30 AM,4.752,19.008,2016-02-08,2,-9.15,-13.05
2/8/16 6:45 AM,4.446,17.784,2016-02-08,4,-9.40,-12.80
2/8/16 7:00 AM,4.584,18.336,2016-02-08,0,-9.40,-12.80
2/8/16 7:15 AM,5.376,21.504,2016-02-08,1,-9.40,-12.80
2/8/16 7:30 AM,3.978,15.912,2016-02-08,2,-9.40,-12.80
2/8/16 7:45 AM,3.876,15.504,2016-02-08,4,-9.40,-12.80
2/8/16 8:00 AM,4.38,17.52,2016-02-08,0,-9.40,-13.05
2/8/16 8:15 AM,4.404,17.616,2016-02-08,1,-9.40,-13.30
2/8/16 8:30 AM,4.698,18.792,2016-02-08,2,-9.40,-13.30
2/8/16 8:45 AM,5.148,20.592,2016-02-08,4,-9.40,-13.30
2/8/16 8:45 AM,5.148,20.592,2016-02-08,4,-9.00,-13.00
2/8/16 9:00 AM,5.628,22.512,2016-02-08,0,-9.10,-13.23
2/8/16 9:15 AM,5.208,20.832,2016-02-08,1,-9.20,-13.45
2/8/16 9:30 AM,4.914,19.656,2016-02-08,2,-9.30,-13.68
2/8/16 9:45 AM,4.896,19.584,2016-02-08,4,-9.40,-13.90
2/8/16 9:45 AM,4.896,19.584,2016-02-08,4,-9.40,-13.90
2/8/16 10:00 AM,4.848,19.392,2016-02-08,0,-9.55,-13.93
2/8/16 10:15 AM,9.876,39.504,2016-02-08,1,-9.70,-13.95
2/8/16 10:30 AM,6.606,26.424,2016-02-08,2,-9.85,-13.98
2/8/16 10:45 AM,8.772,35.088,2016-02-08,4,-10.00,-14.00
2/8/16 10:45 AM,8.772,35.088,2016-02-08,4,-10.00,-14.40
2/8/16 11:00 AM,8.178,32.712,2016-02-08,0,-10.30,-14.70
2/8/16 11:15 AM,7.896,31.584,2016-02-08,1,-10.60,-15.00
2/8/16 11:30 AM,8.55,34.2,2016-02-08,2,-10.60,-15.00
2/8/16 11:45 AM,6.864,27.456,2016-02-08,4,-10.60,-15.00
2/8/16 12:00 PM,5.862,23.448,2016-02-08,0,-10.60,-15.00
2/8/16 12:15 PM,6.18,24.72,2016-02-08,1,-10.60,-15.00
2/8/16 12:30 PM,4.932,19.728,2016-02-08,2,-11.10,-15.00
2/8/16 12:45 PM,5.652,22.608,2016-02-08,4,-11.00,-16.00
2/8/16 12:45 PM,5.652,22.608,2016-02-08,4,-11.10,-15.60
2/8/16 1:00 PM,4.986,19.944,2016-02-08,0,-11.25,-15.88
2/8/16 1:15 PM,4.914,19.656,2016-02-08,1,-11.40,-16.15
2/8/16 1:30 PM,4.962,19.848,2016-02-08,2,-11.55,-16.43
2/8/16 1:45 PM,4.728,18.912,2016-02-08,4,-11.70,-16.70
2/8/16 2:00 PM,5.022,20.088,2016-02-08,0,-11.70,-16.55
2/8/16 2:15 PM,4.914,19.656,2016-02-08,1,-11.70,-16.40
2/8/16 2:30 PM,4.764,19.056,2016-02-08,2,-11.70,-16.25
2/8/16 2:45 PM,4.758,19.032,2016-02-08,4,-11.70,-16.10
2/8/16 3:00 PM,5.352,21.408,2016-02-08,0,-11.55,-16.10
2/8/16 3:15 PM,5.028,20.112,2016-02-08,1,-11.40,-16.10
2/8/16 3:30 PM,4.98,19.92,2016-02-08,2,-11.25,-16.10
2/8/16 3:45 PM,4.848,19.392,2016-02-08,4,-11.10,-16.10
2/8/16 4:00 PM,4.164,16.656,2016-02-08,0,-10.98,-16.10
2/8/16 4:15 PM,3.876,15.504,2016-02-08,1,-10.85,-16.10
2/8/16 4:30 PM,4.494,17.976,2016-02-08,2,-10.73,-16.10
2/8/16 4:45 PM,4.512,18.048,2016-02-08,4,-10.60,-16.10
2/8/16 5:00 PM,4.314,17.256,2016-02-08,0,-10.45,-15.98
2/8/16 5:15 PM,4.362,17.448,2016-02-08,1,-10.30,-15.85
2/8/16 5:30 PM,5.082,20.328,2016-02-08,2,-10.15,-15.73
2/8/16 5:45 PM,5.1,20.4,2016-02-08,4,-10.00,-15.60
2/8/16 6:00 PM,4.836,19.344,2016-02-08,0,-10.00,-15.60
2/8/16 6:15 PM,5.736,22.944,2016-02-08,1,-10.00,-15.60
2/8/16 6:15 PM,5.736,22.944,2016-02-08,1,-9.40,-14.40
2/8/16 6:30 PM,5.112,20.448,2016-02-08,2,-9.15,-14.70
2/8/16 6:45 PM,4.86,19.44,2016-02-08,4,-8.90,-15.00
2/8/16 7:00 PM,4.776,19.104,2016-02-08,0,-8.93,-14.75
2/8/16 7:15 PM,5.07,20.28,2016-02-08,1,-8.95,-14.50
2/8/16 7:30 PM,4.926,19.704,2016-02-08,2,-8.98,-14.25
2/8/16 7:45 PM,4.494,17.976,2016-02-08,4,-9.00,-14.00
2/8/16 7:45 PM,4.494,17.976,2016-02-08,4,-8.90,-14.40
2/8/16 8:00 PM,4.668,18.672,2016-02-08,0,-8.90,-14.70
2/8/16 8:15 PM,4.788,19.152,2016-02-08,1,-8.90,-15.00
2/8/16 8:30 PM,4.296,17.184,2016-02-08,2,-9.15,-14.70
2/8/16 8:45 PM,3.858,15.432,2016-02-08,4,-9.40,-14.40
2/8/16 9:00 PM,3.936,15.744,2016-02-08,0,-9.28,-14.55
2/8/16 9:15 PM,3.954,15.816,2016-02-08,1,-9.15,-14.70
2/8/16 9:30 PM,3.69,14.76,2016-02-08,2,-9.03,-14.85
2/8/16 9:45 PM,3.822,15.288,2016-02-08,4,-8.90,-15.00
2/8/16 10:00 PM,3.882,15.528,2016-02-08,0,-8.90,-14.70
2/8/16 10:15 PM,3.81,15.24,2016-02-08,1,-8.90,-14.40
2/8/16 10:30 PM,3.714,14.856,2016-02-08,2,-8.90,-14.40
2/8/16 10:45 PM,3.876,15.504,2016-02-08,4,-8.90,-14.40
2/8/16 10:45 PM,3.876,15.504,2016-02-08,4,-9.00,-14.00
2/8/16 11:00 PM,3.858,15.432,2016-02-08,0,-8.98,-14.10
2/8/16 11:15 PM,3.816,15.264,2016-02-08,1,-8.95,-14.20
2/8/16 11:30 PM,3.9,15.6,2016-02-08,2,-8.93,-14.30
2/8/16 11:45 PM,3.966,15.864,2016-02-08,4,-8.90,-14.40
2/9/16 12:00 AM,3.774,15.096,2016-02-09,0,-8.90,-14.40
2/9/16 12:15 AM,3.744,14.976,2016-02-09,1,-8.90,-14.40
2/9/16 12:30 AM,8.544,34.176,2016-02-09,2,-8.95,-14.20
2/9/16 12:45 AM,5.904,23.616,2016-02-09,4,-9.00,-14.00
2/9/16 12:45 AM,5.904,23.616,2016-02-09,4,-9.40,-14.40
2/9/16 1:00 AM,3.72,14.88,2016-02-09,0,-9.40,-14.40
2/9/16 1:15 AM,6.024,24.096,2016-02-09,1,-9.40,-14.40
2/9/16 1:15 AM,6.024,24.096,2016-02-09,1,-9.40,-14.40
2/9/16 1:30 AM,4.026,16.104,2016-02-09,2,-9.70,-14.15
2/9/16 1:45 AM,4.416,17.664,2016-02-09,4,-10.00,-13.90
2/9/16 2:00 AM,3.852,15.408,2016-02-09,0,-10.00,-13.90
2/9/16 2:15 AM,3.924,15.696,2016-02-09,1,-10.00,-13.90
2/9/16 2:30 AM,3.84,15.36,2016-02-09,2,-10.00,-14.45
2/9/16 2:45 AM,3.81,15.24,2016-02-09,4,-10.00,-15.00
2/9/16 2:45 AM,3.81,15.24,2016-02-09,4,-10.00,-15.00
2/9/16 3:00 AM,4.026,16.104,2016-02-09,0,-10.15,-15.00
2/9/16 3:15 AM,3.714,14.856,2016-02-09,1,-10.30,-15.00
2/9/16 3:30 AM,3.822,15.288,2016-02-09,2,-10.45,-15.00
2/9/16 3:45 AM,4.038,16.152,2016-02-09,4,-10.60,-15.00
2/9/16 4:00 AM,3.69,14.76,2016-02-09,0,-10.60,-15.15
2/9/16 4:15 AM,3.9,15.6,2016-02-09,1,-10.60,-15.30
2/9/16 4:30 AM,3.93,15.72,2016-02-09,2,-10.60,-15.45
2/9/16 4:45 AM,3.924,15.696,2016-02-09,4,-10.60,-15.60
2/9/16 4:45 AM,3.924,15.696,2016-02-09,4,-11.00,-16.00
2/9/16 5:00 AM,3.78,15.12,2016-02-09,0,-11.03,-15.90
2/9/16 5:15 AM,4.098,16.392,2016-02-09,1,-11.05,-15.80
2/9/16 5:30 AM,3.78,15.12,2016-02-09,2,-11.08,-15.70
2/9/16 5:45 AM,7.05,28.2,2016-02-09,4,-11.10,-15.60
2/9/16 6:00 AM,8.202,32.808,2016-02-09,0,-11.10,-15.60
2/9/16 6:15 AM,5.604,22.416,2016-02-09,1,-11.10,-15.60
2/9/16 6:30 AM,5.976,23.904,2016-02-09,2,-11.10,-15.60
2/9/16 6:45 AM,4.362,17.448,2016-02-09,4,-11.10,-15.60
2/9/16 7:00 AM,6.288,25.152,2016-02-09,0,-11.25,-15.88
2/9/16 7:15 AM,4.644,18.576,2016-02-09,1,-11.40,-16.15
2/9/16 7:30 AM,5.676,22.704,2016-02-09,2,-11.55,-16.43
2/9/16 7:45 AM,4.368,17.472,2016-02-09,4,-11.70,-16.70
2/9/16 8:00 AM,5.598,22.392,2016-02-09,0,-11.98,-16.98
2/9/16 8:15 AM,4.596,18.384,2016-02-09,1,-12.25,-17.25
2/9/16 8:30 AM,4.776,19.104,2016-02-09,2,-12.53,-17.53
2/9/16 8:45 AM,5.004,20.016,2016-02-09,4,-12.80,-17.80
2/9/16 9:00 AM,5.43,21.72,2016-02-09,0,-12.93,-17.80
2/9/16 9:15 AM,5.028,20.112,2016-02-09,1,-13.05,-17.80
2/9/16 9:30 AM,5.394,21.576,2016-02-09,2,-13.18,-17.80
2/9/16 9:45 AM,6.762,27.048,2016-02-09,4,-13.30,-17.80
2/9/16 10:00 AM,9.75,39,2016-02-09,0,-13.30,-17.80
2/9/16 10:15 AM,6.468,25.872,2016-02-09,1,-13.30,-17.80
2/9/16 10:30 AM,11.202,44.808,2016-02-09,2,-13.30,-17.80
2/9/16 10:45 AM,7.74,30.96,2016-02-09,4,-13.90,-18.30
2/9/16 11:00 AM,6.84,27.36,2016-02-09,0,-14.03,-18.45
2/9/16 11:15 AM,7.62,30.48,2016-02-09,1,-14.15,-18.60
2/9/16 11:30 AM,5.736,22.944,2016-02-09,2,-14.28,-18.75
2/9/16 11:45 AM,5.454,21.816,2016-02-09,4,-14.40,-18.90
2/9/16 12:00 PM,4.8,19.2,2016-02-09,0,-14.40,-18.90
2/9/16 12:15 PM,5.058,20.232,2016-02-09,1,-14.40,-18.90
2/9/16 12:30 PM,5.268,21.072,2016-02-09,2,-14.70,-18.90
2/9/16 12:45 PM,4.932,19.728,2016-02-09,4,-15.00,-18.90
2/9/16 1:00 PM,5.712,22.848,2016-02-09,0,-15.00,-18.90
2/9/16 1:15 PM,6.606,26.424,2016-02-09,1,-15.00,-18.90
2/9/16 1:30 PM,5.052,20.208,2016-02-09,2,-15.00,-18.90
2/9/16 1:45 PM,5.004,20.016,2016-02-09,4,-15.00,-18.90
2/9/16 2:00 PM,5.106,20.424,2016-02-09,0,-14.73,-18.90
2/9/16 2:15 PM,5.172,20.688,2016-02-09,1,-14.45,-18.90
2/9/16 2:30 PM,6.084,24.336,2016-02-09,2,-14.18,-18.90
2/9/16 2:45 PM,5.928,23.712,2016-02-09,4,-13.90,-18.90
2/9/16 3:00 PM,6.882,27.528,2016-02-09,0,-13.63,-18.75
2/9/16 3:15 PM,7.71,30.84,2016-02-09,1,-13.35,-18.60
2/9/16 3:30 PM,8.202,32.808,2016-02-09,2,-13.08,-18.45
2/9/16 3:45 PM,6.942,27.768,2016-02-09,4,-12.80,-18.30
2/9/16 4:00 PM,8.148,32.592,2016-02-09,0,-12.53,-18.30
2/9/16 4:15 PM,4.68,18.72,2016-02-09,1,-12.25,-18.30
2/9/16 4:30 PM,4.626,18.504,2016-02-09,2,-11.98,-18.30
2/9/16 4:45 PM,4.32,17.28,2016-02-09,4,-11.70,-18.30
2/9/16 5:00 PM,4.392,17.568,2016-02-09,0,-11.28,-18.18
2/9/16 5:15 PM,4.272,17.088,2016-02-09,1,-10.85,-18.05
2/9/16 5:30 PM,4.38,17.52,2016-02-09,2,-10.43,-17.93
2/9/16 5:45 PM,4.374,17.496,2016-02-09,4,-10.00,-17.80
2/9/16 6:00 PM,4.212,16.848,2016-02-09,0,-10.00,-17.80
2/9/16 6:15 PM,4.182,16.728,2016-02-09,1,-10.00,-17.80
2/9/16 6:30 PM,4.47,17.88,2016-02-09,2,-9.70,-17.50
2/9/16 6:45 PM,4.302,17.208,2016-02-09,4,-9.40,-17.20
2/9/16 7:00 PM,4.152,16.608,2016-02-09,0,-9.28,-17.35
2/9/16 7:15 PM,4.164,16.656,2016-02-09,1,-9.15,-17.50
2/9/16 7:30 PM,4.32,17.28,2016-02-09,2,-9.03,-17.65
2/9/16 7:45 PM,4.404,17.616,2016-02-09,4,-8.90,-17.80
2/9/16 8:00 PM,4.026,16.104,2016-02-09,0,-8.90,-17.93
2/9/16 8:15 PM,4.452,17.808,2016-02-09,1,-8.90,-18.05
2/9/16 8:30 PM,4.362,17.448,2016-02-09,2,-8.90,-18.18
2/9/16 8:45 PM,4.23,16.92,2016-02-09,4,-8.90,-18.30
2/9/16 9:00 PM,3.348,13.392,2016-02-09,0,-8.90,-18.18
2/9/16 9:15 PM,3.582,14.328,2016-02-09,1,-8.90,-18.05
2/9/16 9:30 PM,3.414,13.656,2016-02-09,2,-8.90,-17.93
2/9/16 9:45 PM,3.624,14.496,2016-02-09,4,-8.90,-17.80
2/9/16 10:00 PM,3.228,12.912,2016-02-09,0,-9.03,-17.93
2/9/16 10:15 PM,3.696,14.784,2016-02-09,1,-9.15,-18.05
2/9/16 10:30 PM,3.51,14.04,2016-02-09,2,-9.28,-18.18
2/9/16 10:45 PM,3.6,14.4,2016-02-09,4,-9.40,-18.30
2/9/16 11:00 PM,3.678,14.712,2016-02-09,0,-9.70,-18.45
2/9/16 11:15 PM,3.414,13.656,2016-02-09,1,-10.00,-18.60
2/9/16 11:30 PM,3.792,15.168,2016-02-09,2,-10.30,-18.75
2/9/16 11:45 PM,3.444,13.776,2016-02-09,4,-10.60,-18.90
2/10/16 12:00 AM,3.624,14.496,2016-02-10,0,-10.60,-18.90
2/10/16 12:15 AM,3.54,14.16,2016-02-10,1,-10.60,-18.90
2/10/16 12:30 AM,3.72,14.88,2016-02-10,2,-10.60,-18.90
2/10/16 12:45 AM,3.624,14.496,2016-02-10,4,-10.60,-18.90
2/10/16 1:00 AM,4.824,19.296,2016-02-10,0,-10.73,-18.90
2/10/16 1:15 AM,7.836,31.344,2016-02-10,1,-10.85,-18.90
2/10/16 1:30 AM,4.65,18.6,2016-02-10,2,-10.98,-18.90
2/10/16 1:45 AM,3.696,14.784,2016-02-10,4,-11.10,-18.90
2/10/16 2:00 AM,3.6,14.4,2016-02-10,0,-11.10,-18.90
2/10/16 2:15 AM,3.648,14.592,2016-02-10,1,-11.10,-18.90
2/10/16 2:30 AM,3.294,13.176,2016-02-10,2,-11.10,-18.90
2/10/16 2:45 AM,3.732,14.928,2016-02-10,4,-11.10,-18.90
2/10/16 3:00 AM,3.636,14.544,2016-02-10,0,-11.38,-19.03
2/10/16 3:15 AM,4.398,17.592,2016-02-10,1,-11.65,-19.15
2/10/16 3:30 AM,3.81,15.24,2016-02-10,2,-11.93,-19.28
2/10/16 3:45 AM,3.438,13.752,2016-02-10,4,-12.20,-19.40
2/10/16 4:00 AM,3.762,15.048,2016-02-10,0,-12.35,-19.55
2/10/16 4:15 AM,4.992,19.968,2016-02-10,1,-12.50,-19.70
2/10/16 4:30 AM,6.108,24.432,2016-02-10,2,-12.65,-19.85
2/10/16 4:45 AM,6.132,24.528,2016-02-10,4,-12.80,-20.00
2/10/16 5:00 AM,3.63,14.52,2016-02-10,0,-12.93,-20.00
2/10/16 5:15 AM,3.576,14.304,2016-02-10,1,-13.05,-20.00
2/10/16 5:30 AM,3.894,15.576,2016-02-10,2,-13.18,-20.00
2/10/16 5:45 AM,6.036,24.144,2016-02-10,4,-13.30,-20.00
2/10/16 6:00 AM,4.056,16.224,2016-02-10,0,-13.30,-20.00
2/10/16 6:15 AM,4.056,16.224,2016-02-10,1,-13.30,-20.00
2/10/16 6:30 AM,4.152,16.608,2016-02-10,2,-13.60,-20.00
2/10/16 6:45 AM,6.114,24.456,2016-02-10,4,-13.90,-20.00
2/10/16 7:00 AM,5.496,21.984,2016-02-10,0,-14.03,-20.00
2/10/16 7:15 AM,8.082,32.328,2016-02-10,1,-14.15,-20.00
2/10/16 7:30 AM,5.298,21.192,2016-02-10,2,-14.28,-20.00
2/10/16 7:45 AM,5.406,21.624,2016-02-10,4,-14.40,-20.00
2/10/16 8:00 AM,4.878,19.512,2016-02-10,0,-14.55,-20.15
2/10/16 8:15 AM,7.2,28.8,2016-02-10,1,-14.70,-20.30
2/10/16 8:30 AM,5.01,20.04,2016-02-10,2,-14.85,-20.45
2/10/16 8:45 AM,5.526,22.104,2016-02-10,4,-15.00,-20.60
2/10/16 9:00 AM,7.386,29.544,2016-02-10,0,-15.00,-20.60
2/10/16 9:15 AM,7.872,31.488,2016-02-10,1,-15.00,-20.60
2/10/16 9:30 AM,8.268,33.072,2016-02-10,2,-15.00,-20.60
2/10/16 9:45 AM,7.176,28.704,2016-02-10,4,-15.00,-20.60
2/10/16 10:00 AM,6.87,27.48,2016-02-10,0,-15.00,-20.45
2/10/16 10:15 AM,6.894,27.576,2016-02-10,1,-15.00,-20.30
2/10/16 10:30 AM,6.066,24.264,2016-02-10,2,-15.00,-20.15
2/10/16 10:45 AM,5.88,23.52,2016-02-10,4,-15.00,-20.00
2/10/16 11:00 AM,7.086,28.344,2016-02-10,0,-15.15,-20.15
2/10/16 11:15 AM,5.568,22.272,2016-02-10,1,-15.30,-20.30
2/10/16 11:30 AM,6.996,27.984,2016-02-10,2,-15.45,-20.45
2/10/16 11:45 AM,6.774,27.096,2016-02-10,4,-15.60,-20.60
2/10/16 12:00 PM,5.976,23.904,2016-02-10,0,-15.60,-20.60
2/10/16 12:15 PM,5.652,22.608,2016-02-10,1,-15.60,-20.60
2/10/16 12:30 PM,5.514,22.056,2016-02-10,2,-15.85,-20.60
2/10/16 12:45 PM,5.736,22.944,2016-02-10,4,-16.10,-20.60
2/10/16 1:00 PM,5.34,21.36,2016-02-10,0,-15.98,-20.60
2/10/16 1:15 PM,5.136,20.544,2016-02-10,1,-15.85,-20.60
2/10/16 1:30 PM,5.106,20.424,2016-02-10,2,-15.73,-20.60
2/10/16 1:45 PM,6.372,25.488,2016-02-10,4,-15.60,-20.60
2/10/16 2:00 PM,6.714,26.856,2016-02-10,0,-15.60,-20.60
2/10/16 2:15 PM,5.73,22.92,2016-02-10,1,-15.60,-20.60
2/10/16 2:30 PM,5.412,21.648,2016-02-10,2,-15.60,-20.60
2/10/16 2:45 PM,5.484,21.936,2016-02-10,4,-15.60,-20.60
2/10/16 3:00 PM,5.004,20.016,2016-02-10,0,-15.30,-20.73
2/10/16 3:15 PM,7.206,28.824,2016-02-10,1,-15.00,-20.85
2/10/16 3:30 PM,9.792,39.168,2016-02-10,2,-14.70,-20.98
2/10/16 3:45 PM,6.066,24.264,2016-02-10,4,-14.40,-21.10
2/10/16 4:00 PM,9.39,37.56,2016-02-10,0,-14.28,-20.98
2/10/16 4:15 PM,5.952,23.808,2016-02-10,1,-14.15,-20.85
2/10/16 4:30 PM,9.054,36.216,2016-02-10,2,-14.03,-20.73
2/10/16 4:45 PM,9.312,37.248,2016-02-10,4,-13.90,-20.60
2/10/16 5:00 PM,12.096,48.384,2016-02-10,0,-13.63,-20.45
2/10/16 5:15 PM,5.856,23.424,2016-02-10,1,-13.35,-20.30
2/10/16 5:30 PM,6,24,2016-02-10,2,-13.08,-20.15
2/10/16 5:45 PM,8.436,33.744,2016-02-10,4,-12.80,-20.00
2/10/16 6:00 PM,8.544,34.176,2016-02-10,0,-12.80,-20.00
2/10/16 6:15 PM,9.996,39.984,2016-02-10,1,-12.80,-20.00
2/10/16 6:30 PM,10.248,40.992,2016-02-10,2,-12.50,-20.00
2/10/16 6:45 PM,10.35,41.4,2016-02-10,4,-12.20,-20.00
2/10/16 7:00 PM,9.864,39.456,2016-02-10,0,-11.93,-19.85
2/10/16 7:15 PM,11.25,45,2016-02-10,1,-11.65,-19.70
2/10/16 7:30 PM,10.392,41.568,2016-02-10,2,-11.38,-19.55
2/10/16 7:45 PM,12.456,49.824,2016-02-10,4,-11.10,-19.40
2/10/16 8:00 PM,9.444,37.776,2016-02-10,0,-10.98,-19.40
2/10/16 8:15 PM,12.558,50.232,2016-02-10,1,-10.85,-19.40
2/10/16 8:30 PM,7.716,30.864,2016-02-10,2,-10.73,-19.40
2/10/16 8:45 PM,5.448,21.792,2016-02-10,4,-10.60,-19.40
2/10/16 9:00 PM,3.606,14.424,2016-02-10,0,-10.60,-19.55
2/10/16 9:15 PM,3.45,13.8,2016-02-10,1,-10.60,-19.70
2/10/16 9:30 PM,3.594,14.376,2016-02-10,2,-10.60,-19.85
2/10/16 9:45 PM,3.174,12.696,2016-02-10,4,-10.60,-20.00
2/10/16 10:00 PM,3.18,12.72,2016-02-10,0,-10.73,-19.85
2/10/16 10:15 PM,3.354,13.416,2016-02-10,1,-10.85,-19.70
2/10/16 10:30 PM,3.336,13.344,2016-02-10,2,-10.98,-19.55
2/10/16 10:45 PM,3.246,12.984,2016-02-10,4,-11.10,-19.40
2/10/16 11:00 PM,3.138,12.552,2016-02-10,0,-11.10,-19.28
2/10/16 11:15 PM,3.39,13.56,2016-02-10,1,-11.10,-19.15
2/10/16 11:30 PM,3.396,13.584,2016-02-10,2,-11.10,-19.03
2/10/16 11:45 PM,3.432,13.728,2016-02-10,4,-11.10,-18.90
2/11/16 12:00 AM,3.498,13.992,2016-02-11,0,-11.10,-18.90
2/11/16 12:15 AM,3.3,13.2,2016-02-11,1,-11.10,-18.90
2/11/16 12:30 AM,3.432,13.728,2016-02-11,2,-11.40,-19.15
2/11/16 12:45 AM,3.396,13.584,2016-02-11,4,-11.70,-19.40
2/11/16 1:00 AM,3.258,13.032,2016-02-11,0,-11.70,-19.40
2/11/16 1:15 AM,3.612,14.448,2016-02-11,1,-11.70,-19.40
2/11/16 1:30 AM,3.39,13.56,2016-02-11,2,-11.70,-19.40
2/11/16 1:45 AM,3.444,13.776,2016-02-11,4,-11.70,-19.40
2/11/16 2:00 AM,3.42,13.68,2016-02-11,0,-11.70,-19.28
2/11/16 2:15 AM,3.444,13.776,2016-02-11,1,-11.70,-19.15
2/11/16 2:30 AM,3.732,14.928,2016-02-11,2,-11.70,-19.03
2/11/16 2:45 AM,4.104,16.416,2016-02-11,4,-11.70,-18.90
2/11/16 3:00 AM,3.624,14.496,2016-02-11,0,-11.70,-18.90
2/11/16 3:15 AM,3.456,13.824,2016-02-11,1,-11.70,-18.90
2/11/16 3:30 AM,3.576,14.304,2016-02-11,2,-11.70,-18.90
2/11/16 3:45 AM,3.498,13.992,2016-02-11,4,-11.70,-18.90
2/11/16 4:00 AM,3.396,13.584,2016-02-11,0,-11.83,-19.18
2/11/16 4:15 AM,7.098,28.392,2016-02-11,1,-11.95,-19.45
2/11/16 4:30 AM,4.95,19.8,2016-02-11,2,-12.08,-19.73
2/11/16 4:45 AM,3.708,14.832,2016-02-11,4,-12.20,-20.00
2/11/16 5:00 AM,3.678,14.712,2016-02-11,0,-12.48,-20.00
2/11/16 5:15 AM,3.324,13.296,2016-02-11,1,-12.75,-20.00
2/11/16 5:30 AM,3.798,15.192,2016-02-11,2,-13.03,-20.00
2/11/16 5:45 AM,4.032,16.128,2016-02-11,4,-13.30,-20.00
2/11/16 6:00 AM,4.146,16.584,2016-02-11,0,-13.30,-20.00
2/11/16 6:15 AM,5.292,21.168,2016-02-11,1,-13.30,-20.00
2/11/16 6:30 AM,5.13,20.52,2016-02-11,2,-13.05,-20.00
2/11/16 6:45 AM,4.638,18.552,2016-02-11,4,-12.80,-20.00
2/11/16 7:00 AM,8.976,35.904,2016-02-11,0,-13.20,-19.85
2/11/16 7:15 AM,6.912,27.648,2016-02-11,1,-13.60,-19.70
2/11/16 7:30 AM,4.548,18.192,2016-02-11,2,-14.00,-19.55
2/11/16 7:45 AM,6.078,24.312,2016-02-11,4,-14.40,-19.40
2/11/16 8:00 AM,4.062,16.248,2016-02-11,0,-14.40,-19.55
2/11/16 8:15 AM,4.806,19.224,2016-02-11,1,-14.40,-19.70
2/11/16 8:30 AM,4.668,18.672,2016-02-11,2,-14.40,-19.85
2/11/16 8:45 AM,5.544,22.176,2016-02-11,4,-14.40,-20.00
2/11/16 9:00 AM,5.454,21.816,2016-02-11,0,-14.55,-20.00
2/11/16 9:15 AM,6.336,25.344,2016-02-11,1,-14.70,-20.00
2/11/16 9:30 AM,5.598,22.392,2016-02-11,2,-14.85,-20.00
2/11/16 9:45 AM,5.694,22.776,2016-02-11,4,-15.00,-20.00
2/11/16 10:00 AM,6.042,24.168,2016-02-11,0,-15.28,-20.00
2/11/16 10:15 AM,10.71,42.84,2016-02-11,1,-15.55,-20.00
2/11/16 10:30 AM,5.838,23.352,2016-02-11,2,-15.83,-20.00
2/11/16 10:45 AM,5.43,21.72,2016-02-11,4,-16.10,-20.00
2/11/16 11:00 AM,6.216,24.864,2016-02-11,0,-15.98,-20.28
2/11/16 11:15 AM,6.9,27.6,2016-02-11,1,-15.85,-20.55
2/11/16 11:30 AM,5.13,20.52,2016-02-11,2,-15.73,-20.83
2/11/16 11:45 AM,4.818,19.272,2016-02-11,4,-15.60,-21.10
2/11/16 12:00 PM,4.98,19.92,2016-02-11,0,-15.60,-21.10
2/11/16 12:15 PM,4.98,19.92,2016-02-11,1,-15.60,-21.10
2/11/16 12:30 PM,4.878,19.512,2016-02-11,2,-15.60,-21.10
2/11/16 12:45 PM,4.854,19.416,2016-02-11,4,-15.60,-21.10
2/11/16 1:00 PM,5.004,20.016,2016-02-11,0,-15.45,-20.98
2/11/16 1:15 PM,4.938,19.752,2016-02-11,1,-15.30,-20.85
2/11/16 1:30 PM,5.022,20.088,2016-02-11,2,-15.15,-20.73
2/11/16 1:45 PM,5.184,20.736,2016-02-11,4,-15.00,-20.60
2/11/16 2:00 PM,4.908,19.632,2016-02-11,0,-14.85,-20.30
2/11/16 2:15 PM,4.584,18.336,2016-02-11,1,-14.70,-20.00
2/11/16 2:30 PM,9.228,36.912,2016-02-11,2,-14.55,-19.70
2/11/16 2:45 PM,5.934,23.736,2016-02-11,4,-14.40,-19.40
2/11/16 3:00 PM,5.316,21.264,2016-02-11,0,-14.13,-19.40
2/11/16 3:15 PM,4.578,18.312,2016-02-11,1,-13.85,-19.40
2/11/16 3:30 PM,5.19,20.76,2016-02-11,2,-13.58,-19.40
2/11/16 3:45 PM,5.202,20.808,2016-02-11,4,-13.30,-19.40
2/11/16 4:00 PM,4.182,16.728,2016-02-11,0,-12.90,-19.55
2/11/16 4:15 PM,3.954,15.816,2016-02-11,1,-12.50,-19.70
2/11/16 4:30 PM,4.326,17.304,2016-02-11,2,-12.10,-19.85
2/11/16 4:45 PM,4.236,16.944,2016-02-11,4,-11.70,-20.00
2/11/16 5:00 PM,4.044,16.176,2016-02-11,0,-11.43,-20.00
2/11/16 5:15 PM,8.394,33.576,2016-02-11,1,-11.15,-20.00
2/11/16 5:30 PM,4.602,18.408,2016-02-11,2,-10.88,-20.00
2/11/16 5:45 PM,4.098,16.392,2016-02-11,4,-10.60,-20.00
2/11/16 6:00 PM,4.17,16.68,2016-02-11,0,-10.60,-20.00
2/11/16 6:15 PM,8.394,33.576,2016-02-11,1,-10.60,-20.00
2/11/16 6:30 PM,4.362,17.448,2016-02-11,2,-10.00,-20.00
2/11/16 6:45 PM,5.388,21.552,2016-02-11,4,-9.40,-20.00
2/11/16 7:00 PM,3.978,15.912,2016-02-11,0,-9.28,-20.00
2/11/16 7:15 PM,4.236,16.944,2016-02-11,1,-9.15,-20.00
2/11/16 7:30 PM,4.068,16.272,2016-02-11,2,-9.03,-20.00
2/11/16 7:45 PM,4.062,16.248,2016-02-11,4,-8.90,-20.00
2/11/16 8:00 PM,4.272,17.088,2016-02-11,0,-8.75,-19.85
2/11/16 8:15 PM,4.278,17.112,2016-02-11,1,-8.60,-19.70
2/11/16 8:30 PM,3.936,15.744,2016-02-11,2,-8.45,-19.55
2/11/16 8:45 PM,4.158,16.632,2016-02-11,4,-8.30,-19.40
2/11/16 9:00 PM,3.498,13.992,2016-02-11,0,-8.45,-19.13
2/11/16 9:15 PM,3.384,13.536,2016-02-11,1,-8.60,-18.85
2/11/16 9:30 PM,3.222,12.888,2016-02-11,2,-8.75,-18.58
2/11/16 9:45 PM,3.438,13.752,2016-02-11,4,-8.90,-18.30
2/11/16 10:00 PM,3.432,13.728,2016-02-11,0,-8.90,-18.18
2/11/16 10:15 PM,3.33,13.32,2016-02-11,1,-8.90,-18.05
2/11/16 10:30 PM,3.336,13.344,2016-02-11,2,-8.90,-17.93
2/11/16 10:45 PM,3.366,13.464,2016-02-11,4,-8.90,-17.80
2/11/16 11:00 PM,3.732,14.928,2016-02-11,0,-9.03,-17.38
2/11/16 11:15 PM,3.372,13.488,2016-02-11,1,-9.15,-16.95
2/11/16 11:30 PM,3.384,13.536,2016-02-11,2,-9.28,-16.53
2/11/16 11:45 PM,3.48,13.92,2016-02-11,4,-9.40,-16.10
2/12/16 12:00 AM,3.36,13.44,2016-02-12,0,-9.40,-16.10
2/12/16 12:15 AM,5.178,20.712,2016-02-12,1,-9.40,-16.10
2/12/16 12:30 AM,6.702,26.808,2016-02-12,2,-9.15,-15.25
2/12/16 12:45 AM,3.384,13.536,2016-02-12,4,-8.90,-14.40
2/12/16 1:00 AM,3.618,14.472,2016-02-12,0,-9.03,-14.13
2/12/16 1:15 AM,3.426,13.704,2016-02-12,1,-9.15,-13.85
2/12/16 1:30 AM,3.33,13.32,2016-02-12,2,-9.28,-13.58
2/12/16 1:45 AM,3.546,14.184,2016-02-12,4,-9.40,-13.30
2/12/16 2:00 AM,3.342,13.368,2016-02-12,0,-9.70,-13.30
2/12/16 2:15 AM,3.414,13.656,2016-02-12,1,-10.00,-13.30
2/12/16 2:30 AM,3.546,14.184,2016-02-12,2,-10.00,-13.30
2/12/16 2:45 AM,3.348,13.392,2016-02-12,4,-10.00,-13.30
2/12/16 3:00 AM,3.714,14.856,2016-02-12,0,-10.00,-13.23
2/12/16 3:15 AM,3.696,14.784,2016-02-12,1,-10.00,-13.15
2/12/16 3:30 AM,4.194,16.776,2016-02-12,2,-10.00,-13.08
2/12/16 3:45 AM,5.22,20.88,2016-02-12,4,-10.00,-13.00
2/12/16 3:45 AM,5.22,20.88,2016-02-12,4,-10.00,-13.30
2/12/16 4:00 AM,7.296,29.184,2016-02-12,0,-10.00,-13.45
2/12/16 4:15 AM,3.48,13.92,2016-02-12,1,-10.00,-13.60
2/12/16 4:30 AM,3.438,13.752,2016-02-12,2,-10.00,-13.75
2/12/16 4:45 AM,3.6,14.4,2016-02-12,4,-10.00,-13.90
2/12/16 5:00 AM,3.708,14.832,2016-02-12,0,-10.00,-13.75
2/12/16 5:15 AM,3.75,15,2016-02-12,1,-10.00,-13.60
2/12/16 5:30 AM,3.672,14.688,2016-02-12,2,-10.00,-13.45
2/12/16 5:45 AM,4.056,16.224,2016-02-12,4,-10.00,-13.30
2/12/16 6:00 AM,4.368,17.472,2016-02-12,0,-10.00,-13.30
2/12/16 6:15 AM,4.188,16.752,2016-02-12,1,-10.00,-13.30
2/12/16 6:30 AM,7.242,28.968,2016-02-12,2,-10.00,-13.30
2/12/16 6:45 AM,5.898,23.592,2016-02-12,4,-10.00,-13.30
2/12/16 7:00 AM,4.326,17.304,2016-02-12,0,-10.00,-13.30
2/12/16 7:15 AM,4.266,17.064,2016-02-12,1,-10.00,-13.30
2/12/16 7:30 AM,4.566,18.264,2016-02-12,2,-10.00,-13.30
2/12/16 7:45 AM,4.428,17.712,2016-02-12,4,-10.00,-13.30
2/12/16 8:00 AM,3.978,15.912,2016-02-12,0,-10.00,-13.30
2/12/16 8:15 AM,4.5,18,2016-02-12,1,-10.00,-13.30
2/12/16 8:30 AM,4.77,19.08,2016-02-12,2,-10.00,-13.30
2/12/16 8:45 AM,6.162,24.648,2016-02-12,4,-10.00,-13.30
2/12/16 9:00 AM,8.418,33.672,2016-02-12,0,-10.15,-13.58
2/12/16 9:15 AM,6.06,24.24,2016-02-12,1,-10.30,-13.85
2/12/16 9:30 AM,6.6,26.4,2016-02-12,2,-10.45,-14.13
2/12/16 9:45 AM,5.778,23.112,2016-02-12,4,-10.60,-14.40
2/12/16 10:00 AM,6.306,25.224,2016-02-12,0,-10.88,-14.70
2/12/16 10:15 AM,7.032,28.128,2016-02-12,1,-11.15,-15.00
2/12/16 10:30 AM,4.908,19.632,2016-02-12,2,-11.43,-15.30
2/12/16 10:45 AM,4.74,18.96,2016-02-12,4,-11.70,-15.60
2/12/16 11:00 AM,6.252,25.008,2016-02-12,0,-11.98,-15.88
2/12/16 11:15 AM,4.32,17.28,2016-02-12,1,-12.25,-16.15
2/12/16 11:30 AM,4.434,17.736,2016-02-12,2,-12.53,-16.43
2/12/16 11:45 AM,4.398,17.592,2016-02-12,4,-12.80,-16.70
2/12/16 12:00 PM,4.308,17.232,2016-02-12,0,-12.80,-16.70
2/12/16 12:15 PM,4.308,17.232,2016-02-12,1,-12.80,-16.70
2/12/16 12:30 PM,4.248,16.992,2016-02-12,2,-13.35,-16.95
2/12/16 12:45 PM,4.374,17.496,2016-02-12,4,-13.90,-17.20
2/12/16 1:00 PM,6.714,26.856,2016-02-12,0,-13.90,-17.48
2/12/16 1:15 PM,5.826,23.304,2016-02-12,1,-13.90,-17.75
2/12/16 1:30 PM,5.754,23.016,2016-02-12,2,-13.90,-18.03
2/12/16 1:45 PM,6.132,24.528,2016-02-12,4,-13.90,-18.30
2/12/16 2:00 PM,4.362,17.448,2016-02-12,0,-13.75,-18.45
2/12/16 2:15 PM,4.284,17.136,2016-02-12,1,-13.60,-18.60
2/12/16 2:30 PM,4.428,17.712,2016-02-12,2,-13.45,-18.75
2/12/16 2:45 PM,5.748,22.992,2016-02-12,4,-13.30,-18.90
2/12/16 3:00 PM,6.588,26.352,2016-02-12,0,-13.30,-19.18
2/12/16 3:15 PM,4.464,17.856,2016-02-12,1,-13.30,-19.45
2/12/16 3:30 PM,6.858,27.432,2016-02-12,2,-13.30,-19.73
2/12/16 3:45 PM,3.978,15.912,2016-02-12,4,-13.30,-20.00
2/12/16 4:00 PM,3.042,12.168,2016-02-12,0,-13.30,-20.15
2/12/16 4:15 PM,3.126,12.504,2016-02-12,1,-13.30,-20.30
2/12/16 4:30 PM,4.104,16.416,2016-02-12,2,-13.30,-20.45
2/12/16 4:45 PM,3.198,12.792,2016-02-12,4,-13.30,-20.60
2/12/16 5:00 PM,3.486,13.944,2016-02-12,0,-13.03,-20.60
2/12/16 5:15 PM,3.33,13.32,2016-02-12,1,-12.75,-20.60
2/12/16 5:30 PM,3.438,13.752,2016-02-12,2,-12.48,-20.60
2/12/16 5:45 PM,3.294,13.176,2016-02-12,4,-12.20,-20.60
2/12/16 6:00 PM,3.204,12.816,2016-02-12,0,-12.20,-20.60
2/12/16 6:15 PM,6.672,26.688,2016-02-12,1,-12.20,-20.60
2/12/16 6:30 PM,7.326,29.304,2016-02-12,2,-12.20,-21.40
2/12/16 6:45 PM,8.82,35.28,2016-02-12,4,-12.20,-22.20
2/12/16 7:00 PM,7.968,31.872,2016-02-12,0,-12.20,-22.35
2/12/16 7:15 PM,4.188,16.752,2016-02-12,1,-12.20,-22.50
2/12/16 7:30 PM,9.222,36.888,2016-02-12,2,-12.20,-22.65
2/12/16 7:45 PM,3.948,15.792,2016-02-12,4,-12.20,-22.80
2/12/16 8:00 PM,6.81,27.24,2016-02-12,0,-12.20,-22.80
2/12/16 8:15 PM,4.236,16.944,2016-02-12,1,-12.20,-22.80
2/12/16 8:30 PM,5.562,22.248,2016-02-12,2,-12.20,-22.80
2/12/16 8:45 PM,6.888,27.552,2016-02-12,4,-12.20,-22.80
2/12/16 9:00 PM,7.128,28.512,2016-02-12,0,-12.20,-22.80
2/12/16 9:15 PM,6.63,26.52,2016-02-12,1,-12.20,-22.80
2/12/16 9:30 PM,3.876,15.504,2016-02-12,2,-12.20,-22.80
2/12/16 9:45 PM,3.99,15.96,2016-02-12,4,-12.20,-22.80
2/12/16 10:00 PM,4.74,18.96,2016-02-12,0,-12.35,-23.08
2/12/16 10:15 PM,4.218,16.872,2016-02-12,1,-12.50,-23.35
2/12/16 10:30 PM,3.738,14.952,2016-02-12,2,-12.65,-23.63
2/12/16 10:45 PM,4.104,16.416,2016-02-12,4,-12.80,-23.90
2/12/16 11:00 PM,4.362,17.448,2016-02-12,0,-13.08,-24.03
2/12/16 11:15 PM,9.618,38.472,2016-02-12,1,-13.35,-24.15
2/12/16 11:30 PM,4.458,17.832,2016-02-12,2,-13.63,-24.28
2/12/16 11:45 PM,4.074,16.296,2016-02-12,4,-13.90,-24.40
2/13/16 12:00 AM,4.038,16.152,2016-02-13,0,-13.90,-24.40
2/13/16 12:15 AM,3.984,15.936,2016-02-13,1,-13.90,-24.40
2/13/16 12:30 AM,4.032,16.128,2016-02-13,2,-14.15,-24.15
2/13/16 12:45 AM,4.038,16.152,2016-02-13,4,-14.40,-23.90
2/13/16 1:00 AM,4.092,16.368,2016-02-13,0,-14.55,-23.75
2/13/16 1:15 AM,4.056,16.224,2016-02-13,1,-14.70,-23.60
2/13/16 1:30 AM,3.978,15.912,2016-02-13,2,-14.85,-23.45
2/13/16 1:45 AM,3.972,15.888,2016-02-13,4,-15.00,-23.30
2/13/16 2:00 AM,7.14,28.56,2016-02-13,0,-15.15,-23.45
2/13/16 2:15 AM,6.72,26.88,2016-02-13,1,-15.30,-23.60
2/13/16 2:30 AM,4.2,16.8,2016-02-13,2,-15.45,-23.75
2/13/16 2:45 AM,4.218,16.872,2016-02-13,4,-15.60,-23.90
2/13/16 3:00 AM,3.906,15.624,2016-02-13,0,-15.88,-23.75
2/13/16 3:15 AM,4.11,16.44,2016-02-13,1,-16.15,-23.60
2/13/16 3:30 AM,3.96,15.84,2016-02-13,2,-16.43,-23.45
2/13/16 3:45 AM,4.164,16.656,2016-02-13,4,-16.70,-23.30
2/13/16 4:00 AM,4.218,16.872,2016-02-13,0,-16.83,-23.45
2/13/16 4:15 AM,4.854,19.416,2016-02-13,1,-16.95,-23.60
2/13/16 4:30 AM,8.34,33.36,2016-02-13,2,-17.08,-23.75
2/13/16 4:45 AM,5.826,23.304,2016-02-13,4,-17.20,-23.90
2/13/16 5:00 AM,4.206,16.824,2016-02-13,0,-17.35,-24.03
2/13/16 5:15 AM,4.17,16.68,2016-02-13,1,-17.50,-24.15
2/13/16 5:30 AM,4.038,16.152,2016-02-13,2,-17.65,-24.28
2/13/16 5:45 AM,4.308,17.232,2016-02-13,4,-17.80,-24.40
2/13/16 6:00 AM,4.242,16.968,2016-02-13,0,-17.80,-24.40
2/13/16 6:15 AM,4.104,16.416,2016-02-13,1,-17.80,-24.40
2/13/16 6:30 AM,4.086,16.344,2016-02-13,2,-18.35,-24.40
2/13/16 6:45 AM,6.552,26.208,2016-02-13,4,-18.90,-24.40
2/13/16 7:00 AM,6.936,27.744,2016-02-13,0,-19.03,-24.40
2/13/16 7:15 AM,4.11,16.44,2016-02-13,1,-19.15,-24.40
2/13/16 7:30 AM,4.038,16.152,2016-02-13,2,-19.28,-24.40
2/13/16 7:45 AM,4.392,17.568,2016-02-13,4,-19.40,-24.40
2/13/16 8:00 AM,4.89,19.56,2016-02-13,0,-19.55,-24.40
2/13/16 8:15 AM,5.148,20.592,2016-02-13,1,-19.70,-24.40
2/13/16 8:30 AM,4.782,19.128,2016-02-13,2,-19.85,-24.40
2/13/16 8:45 AM,6.366,25.464,2016-02-13,4,-20.00,-24.40
2/13/16 9:00 AM,10.086,40.344,2016-02-13,0,-20.15,-24.55
2/13/16 9:15 AM,7.122,28.488,2016-02-13,1,-20.30,-24.70
2/13/16 9:30 AM,7.134,28.536,2016-02-13,2,-20.45,-24.85
2/13/16 9:45 AM,6.978,27.912,2016-02-13,4,-20.60,-25.00
2/13/16 10:00 AM,4.812,19.248,2016-02-13,0,-20.73,-25.00
2/13/16 10:15 AM,5.814,23.256,2016-02-13,1,-20.85,-25.00
2/13/16 10:30 AM,5.658,22.632,2016-02-13,2,-20.98,-25.00
2/13/16 10:45 AM,6.672,26.688,2016-02-13,4,-21.10,-25.00
2/13/16 11:00 AM,7.74,30.96,2016-02-13,0,-21.10,-25.00
2/13/16 11:15 AM,7.566,30.264,2016-02-13,1,-21.10,-25.00
2/13/16 11:30 AM,8.214,32.856,2016-02-13,2,-21.10,-25.00
2/13/16 11:45 AM,8.934,35.736,2016-02-13,4,-21.10,-25.00
2/13/16 12:00 PM,7.518,30.072,2016-02-13,0,-21.10,-25.00
2/13/16 12:15 PM,9.672,38.688,2016-02-13,1,-21.10,-25.00
2/13/16 12:30 PM,8.28,33.12,2016-02-13,2,-20.85,-25.30
2/13/16 12:45 PM,9.87,39.48,2016-02-13,4,-20.60,-25.60
2/13/16 1:00 PM,6.84,27.36,2016-02-13,0,-20.73,-25.45
2/13/16 1:15 PM,10.884,43.536,2016-02-13,1,-20.85,-25.30
2/13/16 1:30 PM,10.944,43.776,2016-02-13,2,-20.98,-25.15
2/13/16 1:45 PM,6.858,27.432,2016-02-13,4,-21.10,-25.00
2/13/16 2:00 PM,9.408,37.632,2016-02-13,0,-20.55,-24.73
2/13/16 2:15 PM,4.758,19.032,2016-02-13,1,-20.00,-24.45
2/13/16 2:30 PM,5.694,22.776,2016-02-13,2,-19.45,-24.18
2/13/16 2:45 PM,3.798,15.192,2016-02-13,4,-18.90,-23.90
2/13/16 3:00 PM,3.558,14.232,2016-02-13,0,-18.75,-23.90
2/13/16 3:15 PM,3.534,14.136,2016-02-13,1,-18.60,-23.90
2/13/16 3:30 PM,3.612,14.448,2016-02-13,2,-18.45,-23.90
2/13/16 3:45 PM,3.552,14.208,2016-02-13,4,-18.30,-23.90
2/13/16 4:00 PM,3.57,14.28,2016-02-13,0,-18.03,-23.75
2/13/16 4:15 PM,4.218,16.872,2016-02-13,1,-17.75,-23.60
2/13/16 4:30 PM,2.91,11.64,2016-02-13,2,-17.48,-23.45
2/13/16 4:45 PM,3.318,13.272,2016-02-13,4,-17.20,-23.30
2/13/16 5:00 PM,3.204,12.816,2016-02-13,0,-16.50,-23.30
2/13/16 5:15 PM,3.264,13.056,2016-02-13,1,-15.80,-23.30
2/13/16 5:30 PM,3.336,13.344,2016-02-13,2,-15.10,-23.30
2/13/16 5:45 PM,3.234,12.936,2016-02-13,4,-14.40,-23.30
2/13/16 6:00 PM,3.354,13.416,2016-02-13,0,-14.40,-23.30
2/13/16 6:15 PM,3.384,13.536,2016-02-13,1,-14.40,-23.30
2/13/16 6:30 PM,3.468,13.872,2016-02-13,2,-14.15,-23.30
2/13/16 6:45 PM,3.762,15.048,2016-02-13,4,-13.90,-23.30
2/13/16 7:00 PM,3.696,14.784,2016-02-13,0,-13.63,-23.30
2/13/16 7:15 PM,5.538,22.152,2016-02-13,1,-13.35,-23.30
2/13/16 7:30 PM,6.666,26.664,2016-02-13,2,-13.08,-23.30
2/13/16 7:45 PM,4.074,16.296,2016-02-13,4,-12.80,-23.30
2/13/16 8:00 PM,3.258,13.032,2016-02-13,0,-12.80,-23.30
2/13/16 8:15 PM,3.6,14.4,2016-02-13,1,-12.80,-23.30
2/13/16 8:30 PM,3.348,13.392,2016-02-13,2,-12.80,-23.30
2/13/16 8:45 PM,3.48,13.92,2016-02-13,4,-12.80,-23.30
2/13/16 9:00 PM,3.342,13.368,2016-02-13,0,-12.65,-23.30
2/13/16 9:15 PM,3.318,13.272,2016-02-13,1,-12.50,-23.30
2/13/16 9:30 PM,3.48,13.92,2016-02-13,2,-12.35,-23.30
2/13/16 9:45 PM,3.486,13.944,2016-02-13,4,-12.20,-23.30
2/13/16 10:00 PM,3.432,13.728,2016-02-13,0,-12.35,-23.18
2/13/16 10:15 PM,3.582,14.328,2016-02-13,1,-12.50,-23.05
2/13/16 10:30 PM,4.236,16.944,2016-02-13,2,-12.65,-22.93
2/13/16 10:45 PM,4.59,18.36,2016-02-13,4,-12.80,-22.80
2/13/16 11:00 PM,7.05,28.2,2016-02-13,0,-13.08,-22.65
2/13/16 11:15 PM,3.33,13.32,2016-02-13,1,-13.35,-22.50
2/13/16 11:30 PM,3.468,13.872,2016-02-13,2,-13.63,-22.35
2/13/16 11:45 PM,3.66,14.64,2016-02-13,4,-13.90,-22.20
2/14/16 12:00 AM,3.714,14.856,2016-02-14,0,-13.90,-22.20
2/14/16 12:15 AM,6.564,26.256,2016-02-14,1,-13.90,-22.20
2/14/16 12:30 AM,3.642,14.568,2016-02-14,2,-13.90,-22.20
2/14/16 12:45 AM,3.516,14.064,2016-02-14,4,-13.90,-22.20
2/14/16 1:00 AM,3.756,15.024,2016-02-14,0,-14.03,-22.08
2/14/16 1:15 AM,6.798,27.192,2016-02-14,1,-14.15,-21.95
2/14/16 1:30 AM,3.594,14.376,2016-02-14,2,-14.28,-21.83
2/14/16 1:45 AM,3.69,14.76,2016-02-14,4,-14.40,-21.70
2/14/16 2:00 AM,3.45,13.8,2016-02-14,0,-14.40,-21.70
2/14/16 2:15 AM,3.522,14.088,2016-02-14,1,-14.40,-21.70
2/14/16 2:30 AM,4.482,17.928,2016-02-14,2,-14.40,-21.70
2/14/16 2:45 AM,7.11,28.44,2016-02-14,4,-14.40,-21.70
2/14/16 3:00 AM,3.564,14.256,2016-02-14,0,-14.28,-21.70
2/14/16 3:15 AM,3.882,15.528,2016-02-14,1,-14.15,-21.70
2/14/16 3:30 AM,3.702,14.808,2016-02-14,2,-14.03,-21.70
2/14/16 3:45 AM,6.444,25.776,2016-02-14,4,-13.90,-21.70
2/14/16 4:00 AM,3.378,13.512,2016-02-14,0,-13.90,-21.70
2/14/16 4:15 AM,4.554,18.216,2016-02-14,1,-13.90,-21.70
2/14/16 4:30 AM,4.728,18.912,2016-02-14,2,-13.90,-21.70
2/14/16 4:45 AM,4.878,19.512,2016-02-14,4,-13.90,-21.70
2/14/16 5:00 AM,3.66,14.64,2016-02-14,0,-13.90,-21.55
2/14/16 5:15 AM,5.628,22.512,2016-02-14,1,-13.90,-21.40
2/14/16 5:30 AM,3.798,15.192,2016-02-14,2,-13.90,-21.25
2/14/16 5:45 AM,4.11,16.44,2016-02-14,4,-13.90,-21.10
2/14/16 6:00 AM,3.996,15.984,2016-02-14,0,-13.90,-21.10
2/14/16 6:15 AM,7.32,29.28,2016-02-14,1,-13.90,-21.10
2/14/16 6:30 AM,4.134,16.536,2016-02-14,2,-13.60,-20.85
2/14/16 6:45 AM,4.212,16.848,2016-02-14,4,-13.30,-20.60
2/14/16 7:00 AM,4.29,17.16,2016-02-14,0,-13.18,-20.60
2/14/16 7:15 AM,4.08,16.32,2016-02-14,1,-13.05,-20.60
2/14/16 7:30 AM,5.034,20.136,2016-02-14,2,-12.93,-20.60
2/14/16 7:45 AM,6.9,27.6,2016-02-14,4,-12.80,-20.60
2/14/16 8:00 AM,5.556,22.224,2016-02-14,0,-12.65,-20.30
2/14/16 8:15 AM,4.692,18.768,2016-02-14,1,-12.50,-20.00
2/14/16 8:30 AM,6.42,25.68,2016-02-14,2,-12.35,-19.70
2/14/16 8:45 AM,9.126,36.504,2016-02-14,4,-12.20,-19.40
2/14/16 9:00 AM,9.966,39.864,2016-02-14,0,-12.35,-19.40
2/14/16 9:15 AM,10.812,43.248,2016-02-14,1,-12.50,-19.40
2/14/16 9:30 AM,9.324,37.296,2016-02-14,2,-12.65,-19.40
2/14/16 9:45 AM,10.86,43.44,2016-02-14,4,-12.80,-19.40
2/14/16 10:00 AM,9.288,37.152,2016-02-14,0,-12.65,-19.28
2/14/16 10:15 AM,7.452,29.808,2016-02-14,1,-12.50,-19.15
2/14/16 10:30 AM,11.106,44.424,2016-02-14,2,-12.35,-19.03
2/14/16 10:45 AM,12.864,51.456,2016-02-14,4,-12.20,-18.90
2/14/16 11:00 AM,12.348,49.392,2016-02-14,0,-12.08,-18.63
2/14/16 11:15 AM,12.42,49.68,2016-02-14,1,-11.95,-18.35
2/14/16 11:30 AM,12.51,50.04,2016-02-14,2,-11.83,-18.08
2/14/16 11:45 AM,12.402,49.608,2016-02-14,4,-11.70,-17.80
2/14/16 12:00 PM,12.51,50.04,2016-02-14,0,-11.70,-17.80
2/14/16 12:15 PM,11.316,45.264,2016-02-14,1,-11.70,-17.80
2/14/16 12:30 PM,4.296,17.184,2016-02-14,2,-11.70,-17.50
2/14/16 12:45 PM,3.906,15.624,2016-02-14,4,-11.70,-17.20
2/14/16 1:00 PM,3.984,15.936,2016-02-14,0,-11.70,-16.93
2/14/16 1:15 PM,5.064,20.256,2016-02-14,1,-11.70,-16.65
2/14/16 1:30 PM,5.316,21.264,2016-02-14,2,-11.70,-16.38
2/14/16 1:45 PM,3.756,15.024,2016-02-14,4,-11.70,-16.10
2/14/16 2:00 PM,3.762,15.048,2016-02-14,0,-11.55,-15.98
2/14/16 2:15 PM,3.54,14.16,2016-02-14,1,-11.40,-15.85
2/14/16 2:30 PM,3.63,14.52,2016-02-14,2,-11.25,-15.73
2/14/16 2:45 PM,3.426,13.704,2016-02-14,4,-11.10,-15.60
2/14/16 3:00 PM,3.594,14.376,2016-02-14,0,-10.73,-15.03
2/14/16 3:15 PM,3.426,13.704,2016-02-14,1,-10.37,-14.47
2/14/16 3:30 PM,3.486,13.944,2016-02-14,2,-10.00,-13.90
2/14/16 3:45 PM,3.546,14.184,2016-02-14,4,-10.00,-13.90
2/14/16 4:00 PM,2.982,11.928,2016-02-14,0,-10.00,-13.60
2/14/16 4:15 PM,2.934,11.736,2016-02-14,1,-10.00,-13.30
2/14/16 4:30 PM,4.614,18.456,2016-02-14,2,-9.70,-13.05
2/14/16 4:45 PM,4.488,17.952,2016-02-14,4,-9.40,-12.80
2/14/16 5:00 PM,4.026,16.104,2016-02-14,0,-9.00,-12.53
2/14/16 5:15 PM,4.662,18.648,2016-02-14,1,-8.60,-12.25
2/14/16 5:30 PM,4.374,17.496,2016-02-14,2,-8.20,-11.98
2/14/16 5:45 PM,3.978,15.912,2016-02-14,4,-7.80,-11.70
2/14/16 6:00 PM,4.062,16.248,2016-02-14,0,-7.80,-11.70
2/14/16 6:15 PM,6.582,26.328,2016-02-14,1,-7.80,-11.70
2/14/16 6:30 PM,6.744,26.976,2016-02-14,2,-7.80,-12.20
2/14/16 6:45 PM,5.58,22.32,2016-02-14,4,-7.80,-12.20
2/14/16 7:00 PM,4.758,19.032,2016-02-14,0,-7.80,-12.08
2/14/16 7:15 PM,4.23,16.92,2016-02-14,1,-7.80,-11.95
2/14/16 7:30 PM,3.798,15.192,2016-02-14,2,-7.80,-11.83
2/14/16 7:45 PM,3.768,15.072,2016-02-14,4,-7.80,-11.70
2/14/16 8:00 PM,3.96,15.84,2016-02-14,0,-7.80,-11.55
2/14/16 8:15 PM,3.936,15.744,2016-02-14,1,-7.80,-11.40
2/14/16 8:30 PM,3.762,15.048,2016-02-14,2,-7.80,-11.25
2/14/16 8:45 PM,4.02,16.08,2016-02-14,4,-7.80,-11.10
2/14/16 9:00 PM,4.044,16.176,2016-02-14,0,-7.65,-11.10
2/14/16 9:15 PM,3.984,15.936,2016-02-14,1,-7.50,-11.10
2/14/16 9:30 PM,3.786,15.144,2016-02-14,2,-7.35,-11.10
2/14/16 9:45 PM,4.026,16.104,2016-02-14,4,-7.20,-11.10
2/14/16 10:00 PM,4.146,16.584,2016-02-14,0,-7.20,-11.10
2/14/16 10:15 PM,4.02,16.08,2016-02-14,1,-7.20,-11.10
2/14/16 10:30 PM,3.756,15.024,2016-02-14,2,-7.20,-11.10
2/14/16 10:45 PM,4.17,16.68,2016-02-14,4,-7.20,-11.10
2/14/16 11:00 PM,4.05,16.2,2016-02-14,0,-7.50,-11.10
2/14/16 11:15 PM,3.984,15.936,2016-02-14,1,-7.80,-11.10
2/14/16 11:30 PM,3.984,15.936,2016-02-14,2,-7.80,-11.10
2/14/16 11:45 PM,4.554,18.216,2016-02-14,4,-7.80,-10.00
2/14/16 11:45 PM,4.554,18.216,2016-02-14,4,-7.80,-10.00
2/15/16 12:00 AM,3.84,15.36,2016-02-15,0,-7.80,-10.00
2/15/16 12:15 AM,4.056,16.224,2016-02-15,1,-7.80,-10.00
2/15/16 12:15 AM,4.056,16.224,2016-02-15,1,-8.30,-10.60
2/15/16 12:15 AM,4.056,16.224,2016-02-15,1,-8.30,-10.60
2/15/16 12:30 AM,4.008,16.032,2016-02-15,2,-8.30,-10.60
2/15/16 12:45 AM,3.822,15.288,2016-02-15,4,-8.30,-10.60
2/15/16 12:45 AM,3.822,15.288,2016-02-15,4,-8.30,-10.60
2/15/16 1:00 AM,3.93,15.72,2016-02-15,0,-8.30,-10.73
2/15/16 1:15 AM,3.9,15.6,2016-02-15,1,-8.30,-10.85
2/15/16 1:30 AM,3.936,15.744,2016-02-15,2,-8.30,-10.98
2/15/16 1:45 AM,3.702,14.808,2016-02-15,4,-8.30,-11.10
2/15/16 2:00 AM,3.918,15.672,2016-02-15,0,-8.18,-11.10
2/15/16 2:15 AM,3.948,15.792,2016-02-15,1,-8.05,-11.10
2/15/16 2:30 AM,4.296,17.184,2016-02-15,2,-7.93,-11.10
2/15/16 2:45 AM,3.624,14.496,2016-02-15,4,-7.80,-11.10
2/15/16 3:00 AM,3.96,15.84,2016-02-15,0,-7.93,-11.10
2/15/16 3:15 AM,3.852,15.408,2016-02-15,1,-8.05,-11.10
2/15/16 3:30 AM,3.834,15.336,2016-02-15,2,-8.18,-11.10
2/15/16 3:45 AM,4.02,16.08,2016-02-15,4,-8.30,-11.10
2/15/16 4:00 AM,3.744,14.976,2016-02-15,0,-8.30,-11.10
2/15/16 4:15 AM,3.984,15.936,2016-02-15,1,-8.30,-11.10
2/15/16 4:30 AM,4.182,16.728,2016-02-15,2,-8.30,-11.10
2/15/16 4:45 AM,3.9,15.6,2016-02-15,4,-8.30,-11.10
2/15/16 5:00 AM,3.804,15.216,2016-02-15,0,-8.18,-11.10
2/15/16 5:15 AM,3.75,15,2016-02-15,1,-8.05,-11.10
2/15/16 5:30 AM,4.668,18.672,2016-02-15,2,-7.93,-11.10
2/15/16 5:45 AM,4.218,16.872,2016-02-15,4,-7.80,-11.10
2/15/16 6:00 AM,3.978,15.912,2016-02-15,0,-7.80,-11.10
2/15/16 6:15 AM,4.038,16.152,2016-02-15,1,-7.80,-11.10
2/15/16 6:30 AM,3.954,15.816,2016-02-15,2,-7.80,-10.85
2/15/16 6:45 AM,4.32,17.28,2016-02-15,4,-7.80,-10.60
2/15/16 7:00 AM,4.224,16.896,2016-02-15,0,-7.80,-10.45
2/15/16 7:15 AM,6.126,24.504,2016-02-15,1,-7.80,-10.30
2/15/16 7:30 AM,5.346,21.384,2016-02-15,2,-7.80,-10.15
2/15/16 7:45 AM,4.152,16.608,2016-02-15,4,-7.80,-10.00
2/15/16 8:00 AM,4.368,17.472,2016-02-15,0,-7.80,-9.80
2/15/16 8:15 AM,4.32,17.28,2016-02-15,1,-7.80,-9.60
2/15/16 8:30 AM,4.248,16.992,2016-02-15,2,-7.80,-9.40
2/15/16 8:45 AM,4.446,17.784,2016-02-15,4,-7.80,-9.40
2/15/16 9:00 AM,4.884,19.536,2016-02-15,0,-7.80,-9.28
2/15/16 9:15 AM,4.956,19.824,2016-02-15,1,-7.80,-9.15
2/15/16 9:30 AM,4.794,19.176,2016-02-15,2,-7.80,-9.03
2/15/16 9:45 AM,4.692,18.768,2016-02-15,4,-7.80,-8.90
2/15/16 10:00 AM,8.136,32.544,2016-02-15,0,-7.65,-8.90
2/15/16 10:15 AM,8.454,33.816,2016-02-15,1,-7.50,-8.90
2/15/16 10:30 AM,7.59,30.36,2016-02-15,2,-7.35,-8.90
2/15/16 10:45 AM,11.16,44.64,2016-02-15,4,-7.20,-8.90
2/15/16 11:00 AM,9.822,39.288,2016-02-15,0,-7.20,-8.75
2/15/16 11:15 AM,8.712,34.848,2016-02-15,1,-7.20,-8.60
2/15/16 11:30 AM,6.78,27.12,2016-02-15,2,-7.20,-8.45
2/15/16 11:45 AM,8.58,34.32,2016-02-15,4,-7.20,-8.30
2/15/16 12:00 PM,4.824,19.296,2016-02-15,0,-7.08,-8.30
2/15/16 12:15 PM,4.482,17.928,2016-02-15,1,-6.95,-8.30
2/15/16 12:30 PM,4.44,17.76,2016-02-15,2,-6.83,-8.30
2/15/16 12:45 PM,4.386,17.544,2016-02-15,4,-6.70,-8.30
2/15/16 1:00 PM,4.602,18.408,2016-02-15,0,-6.70,-8.30
2/15/16 1:15 PM,4.506,18.024,2016-02-15,1,-6.70,-8.30
2/15/16 1:30 PM,4.458,17.832,2016-02-15,2,-6.70,-8.30
2/15/16 1:45 PM,4.44,17.76,2016-02-15,4,-6.70,-8.30
2/15/16 2:00 PM,4.44,17.76,2016-02-15,0,-6.55,-8.18
2/15/16 2:15 PM,4.308,17.232,2016-02-15,1,-6.40,-8.05
2/15/16 2:30 PM,4.428,17.712,2016-02-15,2,-6.25,-7.93
2/15/16 2:45 PM,4.494,17.976,2016-02-15,4,-6.10,-7.80
2/15/16 2:45 PM,4.494,17.976,2016-02-15,4,-6.00,-8.00
2/15/16 3:00 PM,4.566,18.264,2016-02-15,0,-5.75,-7.80
2/15/16 3:15 PM,4.578,18.312,2016-02-15,1,-5.50,-7.60
2/15/16 3:30 PM,4.74,18.96,2016-02-15,2,-5.25,-7.40
2/15/16 3:45 PM,4.62,18.48,2016-02-15,4,-5.00,-7.20
2/15/16 4:00 PM,3.75,15,2016-02-15,0,-4.63,-6.83
2/15/16 4:15 PM,3.804,15.216,2016-02-15,1,-4.27,-6.47
2/15/16 4:30 PM,4.848,19.392,2016-02-15,2,-3.90,-6.10
2/15/16 4:45 PM,4.212,16.848,2016-02-15,4,-2.80,-6.10
2/15/16 5:00 PM,4.23,16.92,2016-02-15,0,-2.60,-6.10
2/15/16 5:15 PM,4.23,16.92,2016-02-15,1,-2.40,-6.10
2/15/16 5:30 PM,4.38,17.52,2016-02-15,2,-2.20,-6.10
2/15/16 5:45 PM,4.038,16.152,2016-02-15,4,-1.70,-6.10
2/15/16 6:00 PM,4.188,16.752,2016-02-15,0,-1.55,-5.98
2/15/16 6:15 PM,4.116,16.464,2016-02-15,1,-1.40,-5.85
2/15/16 6:30 PM,4.122,16.488,2016-02-15,2,-1.25,-5.73
2/15/16 6:45 PM,3.888,15.552,2016-02-15,4,-1.10,-5.60
2/15/16 7:00 PM,4.092,16.368,2016-02-15,0,-0.98,-5.60
2/15/16 7:15 PM,4.002,16.008,2016-02-15,1,-0.85,-5.60
2/15/16 7:30 PM,3.9,15.6,2016-02-15,2,-0.73,-5.60
2/15/16 7:45 PM,4.176,16.704,2016-02-15,4,-0.60,-5.60
2/15/16 8:00 PM,3.99,15.96,2016-02-15,0,-0.45,-5.45
2/15/16 8:15 PM,3.84,15.36,2016-02-15,1,-0.30,-5.30
2/15/16 8:30 PM,3.864,15.456,2016-02-15,2,-0.15,-5.15
2/15/16 8:45 PM,3.54,14.16,2016-02-15,4,0.00,-5.00
2/15/16 9:00 PM,3.012,12.048,2016-02-15,0,-0.15,-4.85
2/15/16 9:15 PM,3.27,13.08,2016-02-15,1,-0.30,-4.70
2/15/16 9:30 PM,3.24,12.96,2016-02-15,2,-0.45,-4.55
2/15/16 9:45 PM,3.246,12.984,2016-02-15,4,-0.60,-4.40
2/15/16 10:00 PM,3.852,15.408,2016-02-15,0,-0.60,-4.28
2/15/16 10:15 PM,3.342,13.368,2016-02-15,1,-0.60,-4.15
2/15/16 10:30 PM,3.024,12.096,2016-02-15,2,-0.60,-4.03
2/15/16 10:45 PM,3.21,12.84,2016-02-15,4,-0.60,-3.90
2/15/16 11:00 PM,3.306,13.224,2016-02-15,0,-0.60,-3.90
2/15/16 11:15 PM,3.144,12.576,2016-02-15,1,-0.60,-3.90
2/15/16 11:30 PM,3.216,12.864,2016-02-15,2,-0.60,-3.90
2/15/16 11:45 PM,3.264,13.056,2016-02-15,4,-0.60,-3.90
2/16/16 12:00 AM,3.264,13.056,2016-02-16,0,-0.60,-3.90
2/16/16 12:15 AM,3.024,12.096,2016-02-16,1,-0.60,-3.90
2/16/16 12:30 AM,3.324,13.296,2016-02-16,2,-0.85,-3.90
2/16/16 12:45 AM,3.198,12.792,2016-02-16,4,-1.10,-3.90
2/16/16 1:00 AM,3.114,12.456,2016-02-16,0,-1.10,-3.90
2/16/16 1:15 AM,3.156,12.624,2016-02-16,1,-1.10,-3.90
2/16/16 1:30 AM,3.288,13.152,2016-02-16,2,-1.10,-3.90
2/16/16 1:45 AM,3.258,13.032,2016-02-16,4,-1.10,-3.90
2/16/16 2:00 AM,3.09,12.36,2016-02-16,0,-1.33,-3.93
2/16/16 2:15 AM,3.18,12.72,2016-02-16,1,-1.55,-3.95
2/16/16 2:30 AM,3.306,13.224,2016-02-16,2,-1.78,-3.98
2/16/16 2:45 AM,3.156,12.624,2016-02-16,4,-2.00,-4.00
2/16/16 2:45 AM,3.156,12.624,2016-02-16,4,-1.70,-3.90
2/16/16 3:00 AM,3.126,12.504,2016-02-16,0,-1.40,-3.90
2/16/16 3:15 AM,3.348,13.392,2016-02-16,1,-1.10,-3.90
2/16/16 3:30 AM,3.15,12.6,2016-02-16,2,-1.10,-3.30
2/16/16 3:45 AM,3.078,12.312,2016-02-16,4,-2.00,-3.00
2/16/16 3:45 AM,3.078,12.312,2016-02-16,4,-1.70,-2.80
2/16/16 4:00 AM,3.312,13.248,2016-02-16,0,-1.55,-2.53
2/16/16 4:15 AM,3.324,13.296,2016-02-16,1,-1.40,-2.25
2/16/16 4:30 AM,3.426,13.704,2016-02-16,2,-1.25,-1.98
2/16/16 4:45 AM,3.63,14.52,2016-02-16,4,-1.10,-1.70
2/16/16 5:00 AM,3.3,13.2,2016-02-16,0,-0.98,-1.70
2/16/16 5:15 AM,3.264,13.056,2016-02-16,1,-0.85,-1.70
2/16/16 5:30 AM,3.024,12.096,2016-02-16,2,-0.73,-1.70
2/16/16 5:45 AM,3.36,13.44,2016-02-16,4,-0.60,-1.70
2/16/16 6:00 AM,3.582,14.328,2016-02-16,0,-0.60,-1.70
2/16/16 6:15 AM,4.368,17.472,2016-02-16,1,-0.60,-1.70
2/16/16 6:30 AM,5.148,20.592,2016-02-16,2,-0.60,-1.70
2/16/16 6:45 AM,4.338,17.352,2016-02-16,4,-0.60,-1.10
2/16/16 6:45 AM,4.338,17.352,2016-02-16,4,-1.00,-1.00
2/16/16 7:00 AM,4.428,17.712,2016-02-16,0,-0.90,-1.03
2/16/16 7:15 AM,4.29,17.16,2016-02-16,1,-0.80,-1.05
2/16/16 7:30 AM,4.194,16.776,2016-02-16,2,-0.70,-1.08
2/16/16 7:45 AM,3.864,15.456,2016-02-16,4,-0.60,-1.10
2/16/16 8:00 AM,4.062,16.248,2016-02-16,0,-0.60,-1.10
2/16/16 8:15 AM,4.032,16.128,2016-02-16,1,-0.60,-1.10
2/16/16 8:30 AM,4.602,18.408,2016-02-16,2,-0.60,-1.10
2/16/16 8:45 AM,4.974,19.896,2016-02-16,4,-0.60,-1.10
2/16/16 9:00 AM,5.148,20.592,2016-02-16,0,-0.60,-1.30
2/16/16 9:15 AM,5.034,20.136,2016-02-16,1,-0.60,-1.50
2/16/16 9:30 AM,5.328,21.312,2016-02-16,2,-0.60,-1.70
2/16/16 9:45 AM,5.448,21.792,2016-02-16,4,-0.60,-1.70
2/16/16 10:00 AM,4.968,19.872,2016-02-16,0,-0.60,-1.50
2/16/16 10:15 AM,4.944,19.776,2016-02-16,1,-0.60,-1.30
2/16/16 10:30 AM,5.214,20.856,2016-02-16,2,-0.60,-1.10
2/16/16 10:45 AM,5.328,21.312,2016-02-16,4,0.00,-1.10
2/16/16 10:45 AM,5.328,21.312,2016-02-16,4,0.00,-1.10
2/16/16 11:00 AM,5.598,22.392,2016-02-16,0,0.00,-1.10
2/16/16 11:15 AM,6.966,27.864,2016-02-16,1,0.00,-1.10
2/16/16 11:30 AM,5.43,21.72,2016-02-16,2,0.00,-1.10
2/16/16 11:45 AM,5.868,23.472,2016-02-16,4,0.00,-0.60
2/16/16 11:45 AM,5.868,23.472,2016-02-16,4,0.00,-0.60
2/16/16 12:00 PM,5.094,20.376,2016-02-16,0,0.00,-0.85
2/16/16 12:15 PM,5.118,20.472,2016-02-16,1,0.00,-1.10
2/16/16 12:15 PM,5.118,20.472,2016-02-16,1,0.00,-0.60
2/16/16 12:30 PM,4.686,18.744,2016-02-16,2,0.00,-1.10
2/16/16 12:45 PM,4.764,19.056,2016-02-16,4,0.00,-1.70
2/16/16 12:45 PM,4.764,19.056,2016-02-16,4,-0.60,-1.70
2/16/16 1:00 PM,6.378,25.512,2016-02-16,0,-0.30,-1.70
2/16/16 1:15 PM,5.112,20.448,2016-02-16,1,0.00,-1.70
2/16/16 1:30 PM,5.004,20.016,2016-02-16,2,-0.30,-1.95
2/16/16 1:45 PM,5.544,22.176,2016-02-16,4,-0.60,-2.20
2/16/16 2:00 PM,5.154,20.616,2016-02-16,0,-0.60,-2.40
2/16/16 2:15 PM,4.434,17.736,2016-02-16,1,-0.60,-2.60
2/16/16 2:30 PM,4.65,18.6,2016-02-16,2,-0.60,-2.80
2/16/16 2:45 PM,5.052,20.208,2016-02-16,4,-0.60,-4.40
2/16/16 3:00 PM,4.272,17.088,2016-02-16,0,-0.45,-4.40
2/16/16 3:15 PM,4.35,17.4,2016-02-16,1,-0.30,-4.40
2/16/16 3:30 PM,4.506,18.024,2016-02-16,2,-0.15,-4.40
2/16/16 3:45 PM,4.188,16.752,2016-02-16,4,0.00,-4.40
2/16/16 4:00 PM,3.672,14.688,2016-02-16,0,-0.15,-4.55
2/16/16 4:15 PM,3.678,14.712,2016-02-16,1,-0.30,-4.70
2/16/16 4:30 PM,3.972,15.888,2016-02-16,2,-0.45,-4.85
2/16/16 4:45 PM,4.224,16.896,2016-02-16,4,-0.60,-5.00
2/16/16 5:00 PM,4.176,16.704,2016-02-16,0,-0.45,-5.00
2/16/16 5:15 PM,4.146,16.584,2016-02-16,1,-0.30,-5.00
2/16/16 5:30 PM,3.918,15.672,2016-02-16,2,-0.15,-5.00
2/16/16 5:45 PM,4.092,16.368,2016-02-16,4,0.00,-5.00
2/16/16 6:00 PM,4.176,16.704,2016-02-16,0,0.00,-5.00
2/16/16 6:15 PM,3.978,15.912,2016-02-16,1,0.00,-5.00
2/16/16 6:30 PM,4.176,16.704,2016-02-16,2,0.00,-5.30
2/16/16 6:45 PM,4.914,19.656,2016-02-16,4,0.00,-5.60
2/16/16 7:00 PM,4.122,16.488,2016-02-16,0,0.15,-5.60
2/16/16 7:15 PM,3.864,15.456,2016-02-16,1,0.30,-5.60
2/16/16 7:30 PM,4.248,16.992,2016-02-16,2,0.45,-5.60
2/16/16 7:45 PM,4.134,16.536,2016-02-16,4,0.60,-5.60
2/16/16 8:00 PM,3.912,15.648,2016-02-16,0,0.73,-5.73
2/16/16 8:15 PM,4.092,16.368,2016-02-16,1,0.85,-5.85
2/16/16 8:30 PM,4.026,16.104,2016-02-16,2,0.98,-5.98
2/16/16 8:45 PM,3.426,13.704,2016-02-16,4,1.10,-6.10
2/16/16 9:00 PM,3.258,13.032,2016-02-16,0,0.68,-6.38
2/16/16 9:15 PM,3.234,12.936,2016-02-16,1,0.25,-6.65
2/16/16 9:30 PM,3.282,13.128,2016-02-16,2,-0.18,-6.93
2/16/16 9:45 PM,2.982,11.928,2016-02-16,4,-0.60,-7.20
2/16/16 10:00 PM,3.33,13.32,2016-02-16,0,-0.60,-7.20
2/16/16 10:15 PM,3.24,12.96,2016-02-16,1,-0.60,-7.20
2/16/16 10:30 PM,3.12,12.48,2016-02-16,2,-0.60,-7.20
2/16/16 10:45 PM,3.162,12.648,2016-02-16,4,-0.60,-7.20
2/16/16 11:00 PM,3.306,13.224,2016-02-16,0,-0.88,-7.48
2/16/16 11:15 PM,3.216,12.864,2016-02-16,1,-1.15,-7.75
2/16/16 11:30 PM,3.186,12.744,2016-02-16,2,-1.43,-8.03
2/16/16 11:45 PM,3.336,13.344,2016-02-16,4,-1.70,-8.30
2/17/16 12:00 AM,3.414,13.656,2016-02-17,0,-1.70,-8.30
2/17/16 12:15 AM,3.018,12.072,2016-02-17,1,-1.70,-8.30
2/17/16 12:30 AM,3.318,13.272,2016-02-17,2,-2.25,-8.60
2/17/16 12:45 AM,3.27,13.08,2016-02-17,4,-2.80,-8.90
2/17/16 1:00 AM,3.18,12.72,2016-02-17,0,-2.93,-8.90
2/17/16 1:15 AM,3.162,12.648,2016-02-17,1,-3.05,-8.90
2/17/16 1:30 AM,4.062,16.248,2016-02-17,2,-3.18,-8.90
2/17/16 1:45 AM,3.192,12.768,2016-02-17,4,-3.30,-8.90
2/17/16 2:00 AM,3.138,12.552,2016-02-17,0,-3.45,-9.03
2/17/16 2:15 AM,3.258,13.032,2016-02-17,1,-3.60,-9.15
2/17/16 2:30 AM,3.438,13.752,2016-02-17,2,-3.75,-9.28
2/17/16 2:45 AM,3.048,12.192,2016-02-17,4,-3.90,-9.40
2/17/16 3:00 AM,3.342,13.368,2016-02-17,0,-4.03,-9.83
2/17/16 3:15 AM,3.378,13.512,2016-02-17,1,-4.15,-10.25
2/17/16 3:30 AM,3.186,12.744,2016-02-17,2,-4.28,-10.68
2/17/16 3:45 AM,3.294,13.176,2016-02-17,4,-4.40,-11.10
2/17/16 4:00 AM,3.306,13.224,2016-02-17,0,-4.55,-11.38
2/17/16 4:15 AM,3.312,13.248,2016-02-17,1,-4.70,-11.65
2/17/16 4:30 AM,3.036,12.144,2016-02-17,2,-4.85,-11.93
2/17/16 4:45 AM,3.354,13.416,2016-02-17,4,-5.00,-12.20
2/17/16 5:00 AM,3.654,14.616,2016-02-17,0,-5.28,-12.35
2/17/16 5:15 AM,3.762,15.048,2016-02-17,1,-5.55,-12.50
2/17/16 5:30 AM,3.474,13.896,2016-02-17,2,-5.83,-12.65
2/17/16 5:45 AM,3.804,15.216,2016-02-17,4,-6.10,-12.80
2/17/16 6:00 AM,3.906,15.624,2016-02-17,0,-6.10,-12.80
2/17/16 6:15 AM,5.592,22.368,2016-02-17,1,-6.10,-12.80
2/17/16 6:30 AM,4.686,18.744,2016-02-17,2,-6.40,-13.05
2/17/16 6:45 AM,4.47,17.88,2016-02-17,4,-6.70,-13.30
2/17/16 7:00 AM,5.304,21.216,2016-02-17,0,-6.83,-13.30
2/17/16 7:15 AM,5.448,21.792,2016-02-17,1,-6.95,-13.30
2/17/16 7:30 AM,4.254,17.016,2016-02-17,2,-7.08,-13.30
2/17/16 7:45 AM,3.9,15.6,2016-02-17,4,-7.20,-13.30
2/17/16 8:00 AM,4.278,17.112,2016-02-17,0,-7.35,-13.45
2/17/16 8:15 AM,4.5,18,2016-02-17,1,-7.50,-13.60
2/17/16 8:30 AM,4.752,19.008,2016-02-17,2,-7.65,-13.75
2/17/16 8:45 AM,5.13,20.52,2016-02-17,4,-7.80,-13.90
2/17/16 9:00 AM,5.322,21.288,2016-02-17,0,-7.93,-14.03
2/17/16 9:15 AM,9.204,36.816,2016-02-17,1,-8.05,-14.15
2/17/16 9:30 AM,8.49,33.96,2016-02-17,2,-8.18,-14.28
2/17/16 9:45 AM,5.454,21.816,2016-02-17,4,-8.30,-14.40
2/17/16 10:00 AM,5.46,21.84,2016-02-17,0,-8.58,-14.28
2/17/16 10:15 AM,5.646,22.584,2016-02-17,1,-8.85,-14.15
2/17/16 10:30 AM,5.76,23.04,2016-02-17,2,-9.13,-14.03
2/17/16 10:45 AM,6.318,25.272,2016-02-17,4,-9.40,-13.90
2/17/16 11:00 AM,6.348,25.392,2016-02-17,0,-9.40,-14.03
2/17/16 11:15 AM,5.358,21.432,2016-02-17,1,-9.40,-14.15
2/17/16 11:30 AM,5.34,21.36,2016-02-17,2,-9.40,-14.28
2/17/16 11:45 AM,5.37,21.48,2016-02-17,4,-9.40,-14.40
2/17/16 12:00 PM,5.352,21.408,2016-02-17,0,-9.40,-14.40
2/17/16 12:15 PM,5.394,21.576,2016-02-17,1,-9.40,-14.40
2/17/16 12:30 PM,7.086,28.344,2016-02-17,2,-9.40,-14.40
2/17/16 12:45 PM,5.766,23.064,2016-02-17,4,-9.40,-14.40
2/17/16 1:00 PM,5.094,20.376,2016-02-17,0,-9.28,-14.28
2/17/16 1:15 PM,5.1,20.4,2016-02-17,1,-9.15,-14.15
2/17/16 1:30 PM,5.598,22.392,2016-02-17,2,-9.03,-14.03
2/17/16 1:45 PM,5.136,20.544,2016-02-17,4,-8.90,-13.90
2/17/16 2:00 PM,5.13,20.52,2016-02-17,0,-8.48,-13.63
2/17/16 2:15 PM,5.058,20.232,2016-02-17,1,-8.05,-13.35
2/17/16 2:30 PM,5.04,20.16,2016-02-17,2,-7.63,-13.08
2/17/16 2:45 PM,5.298,21.192,2016-02-17,4,-7.20,-12.80
2/17/16 3:00 PM,5.208,20.832,2016-02-17,0,-6.93,-12.80
2/17/16 3:15 PM,4.968,19.872,2016-02-17,1,-6.65,-12.80
2/17/16 3:30 PM,5.328,21.312,2016-02-17,2,-6.38,-12.80
2/17/16 3:45 PM,5.43,21.72,2016-02-17,4,-6.10,-12.80
2/17/16 4:00 PM,4.584,18.336,2016-02-17,0,-5.55,-12.80
2/17/16 4:15 PM,4.272,17.088,2016-02-17,1,-5.00,-12.80
2/17/16 4:30 PM,4.956,19.824,2016-02-17,2,-4.45,-12.80
2/17/16 4:45 PM,6.822,27.288,2016-02-17,4,-3.90,-12.80
2/17/16 5:00 PM,6.702,26.808,2016-02-17,0,-3.75,-12.65
2/17/16 5:15 PM,5.958,23.832,2016-02-17,1,-3.60,-12.50
2/17/16 5:30 PM,6.204,24.816,2016-02-17,2,-3.45,-12.35
2/17/16 5:45 PM,6.984,27.936,2016-02-17,4,-3.30,-12.20
2/17/16 6:00 PM,7.32,29.28,2016-02-17,0,-3.30,-12.20
2/17/16 6:15 PM,9.33,37.32,2016-02-17,1,-3.30,-12.20
2/17/16 6:30 PM,10.59,42.36,2016-02-17,2,-3.05,-12.20
2/17/16 6:45 PM,8.688,34.752,2016-02-17,4,-2.80,-12.20
2/17/16 7:00 PM,7.818,31.272,2016-02-17,0,-2.65,-12.35
2/17/16 7:15 PM,5.808,23.232,2016-02-17,1,-2.50,-12.50
2/17/16 7:30 PM,6.906,27.624,2016-02-17,2,-2.35,-12.65
2/17/16 7:45 PM,7.746,30.984,2016-02-17,4,-2.20,-12.80
2/17/16 8:00 PM,7.926,31.704,2016-02-17,0,-2.20,-12.38
2/17/16 8:15 PM,7.62,30.48,2016-02-17,1,-2.20,-11.95
2/17/16 8:30 PM,6.462,25.848,2016-02-17,2,-2.20,-11.53
2/17/16 8:45 PM,4.47,17.88,2016-02-17,4,-2.20,-11.10
2/17/16 9:00 PM,3.966,15.864,2016-02-17,0,-2.20,-10.98
2/17/16 9:15 PM,3.696,14.784,2016-02-17,1,-2.20,-10.85
2/17/16 9:30 PM,3.648,14.592,2016-02-17,2,-2.20,-10.73
2/17/16 9:45 PM,3.81,15.24,2016-02-17,4,-2.20,-10.60
2/17/16 10:00 PM,3.672,14.688,2016-02-17,0,-2.20,-10.60
2/17/16 10:15 PM,3.528,14.112,2016-02-17,1,-2.20,-10.60
2/17/16 10:30 PM,3.75,15,2016-02-17,2,-2.20,-10.60
2/17/16 10:45 PM,3.774,15.096,2016-02-17,4,-2.20,-10.60
2/17/16 11:00 PM,3.48,13.92,2016-02-17,0,-2.20,-10.60
2/17/16 11:15 PM,3.846,15.384,2016-02-17,1,-2.20,-10.60
2/17/16 11:30 PM,3.75,15,2016-02-17,2,-2.20,-10.60
2/17/16 11:45 PM,3.612,14.448,2016-02-17,4,-2.20,-10.60
2/18/16 12:00 AM,3.756,15.024,2016-02-18,0,-2.20,-10.60
2/18/16 12:15 AM,3.726,14.904,2016-02-18,1,-2.20,-10.60
2/18/16 12:30 AM,3.486,13.944,2016-02-18,2,-2.50,-10.30
2/18/16 12:45 AM,3.756,15.024,2016-02-18,4,-2.80,-10.00
2/18/16 1:00 AM,3.774,15.096,2016-02-18,0,-2.80,-10.15
2/18/16 1:15 AM,3.528,14.112,2016-02-18,1,-2.80,-10.30
2/18/16 1:30 AM,3.702,14.808,2016-02-18,2,-2.80,-10.45
2/18/16 1:45 AM,3.738,14.952,2016-02-18,4,-2.80,-10.60
2/18/16 2:00 AM,3.954,15.816,2016-02-18,0,-2.80,-10.60
2/18/16 2:15 AM,3.948,15.792,2016-02-18,1,-2.80,-10.60
2/18/16 2:30 AM,3.708,14.832,2016-02-18,2,-2.80,-10.60
2/18/16 2:45 AM,3.654,14.616,2016-02-18,4,-2.80,-10.60
2/18/16 3:00 AM,3.582,14.328,2016-02-18,0,-2.80,-10.60
2/18/16 3:15 AM,3.702,14.808,2016-02-18,1,-2.80,-10.60
2/18/16 3:30 AM,3.828,15.312,2016-02-18,2,-2.80,-10.60
2/18/16 3:45 AM,3.474,13.896,2016-02-18,4,-2.80,-10.60
2/18/16 4:00 AM,3.696,14.784,2016-02-18,0,-2.93,-10.60
2/18/16 4:15 AM,3.714,14.856,2016-02-18,1,-3.05,-10.60
2/18/16 4:30 AM,3.606,14.424,2016-02-18,2,-3.18,-10.60
2/18/16 4:45 AM,3.594,14.376,2016-02-18,4,-3.30,-10.60
2/18/16 5:00 AM,3.774,15.096,2016-02-18,0,-3.45,-10.60
2/18/16 5:15 AM,3.744,14.976,2016-02-18,1,-3.60,-10.60
2/18/16 5:30 AM,3.486,13.944,2016-02-18,2,-3.75,-10.60
2/18/16 5:45 AM,3.702,14.808,2016-02-18,4,-3.90,-10.60
2/18/16 6:00 AM,3.93,15.72,2016-02-18,0,-3.90,-10.60
2/18/16 6:15 AM,5.226,20.904,2016-02-18,1,-3.90,-10.60
2/18/16 6:30 AM,4.566,18.264,2016-02-18,2,-3.90,-10.00
2/18/16 6:45 AM,4.218,16.872,2016-02-18,4,-3.90,-9.40
2/18/16 7:00 AM,4.506,18.024,2016-02-18,0,-3.75,-9.13
2/18/16 7:15 AM,5.022,20.088,2016-02-18,1,-3.60,-8.85
2/18/16 7:30 AM,4.05,16.2,2016-02-18,2,-3.45,-8.58
2/18/16 7:45 AM,4.128,16.512,2016-02-18,4,-3.30,-8.30
2/18/16 8:00 AM,4.806,19.224,2016-02-18,0,-3.18,-8.18
2/18/16 8:15 AM,3.93,15.72,2016-02-18,1,-3.05,-8.05
2/18/16 8:30 AM,4.68,18.72,2016-02-18,2,-2.93,-7.93
2/18/16 8:45 AM,4.95,19.8,2016-02-18,4,-2.80,-7.80
2/18/16 9:00 AM,5.052,20.208,2016-02-18,0,-2.65,-7.53
2/18/16 9:15 AM,5.166,20.664,2016-02-18,1,-2.50,-7.25
2/18/16 9:30 AM,5.46,21.84,2016-02-18,2,-2.35,-6.98
2/18/16 9:45 AM,5.502,22.008,2016-02-18,4,-2.20,-6.70
2/18/16 10:00 AM,5.106,20.424,2016-02-18,0,-2.20,-6.70
2/18/16 10:15 AM,5.364,21.456,2016-02-18,1,-2.20,-6.70
2/18/16 10:30 AM,5.346,21.384,2016-02-18,2,-2.20,-6.40
2/18/16 10:45 AM,5.46,21.84,2016-02-18,4,-2.20,-6.10
2/18/16 10:45 AM,5.46,21.84,2016-02-18,4,-2.20,-6.10
2/18/16 11:00 AM,7.116,28.464,2016-02-18,0,-2.20,-6.10
2/18/16 11:15 AM,5.544,22.176,2016-02-18,1,-2.20,-6.10
2/18/16 11:30 AM,5.172,20.688,2016-02-18,2,-2.20,-6.10
2/18/16 11:45 AM,5.022,20.088,2016-02-18,4,-2.20,-6.10
2/18/16 12:00 PM,4.614,18.456,2016-02-18,0,-2.20,-6.10
2/18/16 12:15 PM,4.728,18.912,2016-02-18,1,-2.20,-6.10
2/18/16 12:30 PM,4.62,18.48,2016-02-18,2,-2.20,-6.10
2/18/16 12:45 PM,4.65,18.6,2016-02-18,4,-2.20,-6.10
2/18/16 1:00 PM,4.416,17.664,2016-02-18,0,-2.20,-6.10
2/18/16 1:15 PM,4.422,17.688,2016-02-18,1,-2.20,-6.10
2/18/16 1:30 PM,4.392,17.568,2016-02-18,2,-2.20,-6.10
2/18/16 1:45 PM,4.446,17.784,2016-02-18,4,-2.20,-6.10
2/18/16 2:00 PM,4.572,18.288,2016-02-18,0,-2.08,-5.98
2/18/16 2:15 PM,4.728,18.912,2016-02-18,1,-1.95,-5.85
2/18/16 2:30 PM,4.578,18.312,2016-02-18,2,-1.83,-5.73
2/18/16 2:45 PM,4.344,17.376,2016-02-18,4,-1.70,-5.60
2/18/16 3:00 PM,4.56,18.24,2016-02-18,0,-1.28,-5.30
2/18/16 3:15 PM,4.536,18.144,2016-02-18,1,-0.85,-5.00
2/18/16 3:30 PM,4.56,18.24,2016-02-18,2,-0.43,-4.70
2/18/16 3:45 PM,4.59,18.36,2016-02-18,4,0.00,-4.40
2/18/16 4:00 PM,4.86,19.44,2016-02-18,0,0.15,-4.13
2/18/16 4:15 PM,3.654,14.616,2016-02-18,1,0.30,-3.85
2/18/16 4:30 PM,3.762,15.048,2016-02-18,2,0.45,-3.58
2/18/16 4:45 PM,4.248,16.992,2016-02-18,4,0.60,-3.30
2/18/16 5:00 PM,4.248,16.992,2016-02-18,0,1.00,-3.03
2/18/16 5:15 PM,4.188,16.752,2016-02-18,1,1.40,-2.75
2/18/16 5:30 PM,4.332,17.328,2016-02-18,2,1.80,-2.48
2/18/16 5:45 PM,4.206,16.824,2016-02-18,4,2.20,-2.20
2/18/16 6:00 PM,3.816,15.264,2016-02-18,0,2.35,-2.20
2/18/16 6:15 PM,4.218,16.872,2016-02-18,1,2.50,-2.20
2/18/16 6:30 PM,4.278,17.112,2016-02-18,2,2.65,-2.20
2/18/16 6:45 PM,4.002,16.008,2016-02-18,4,2.80,-2.20
2/18/16 7:00 PM,4.194,16.776,2016-02-18,0,2.80,-2.08
2/18/16 7:15 PM,4.212,16.848,2016-02-18,1,2.80,-1.95
2/18/16 7:30 PM,4.122,16.488,2016-02-18,2,2.80,-1.83
2/18/16 7:45 PM,3.912,15.648,2016-02-18,4,2.80,-1.70
2/18/16 8:00 PM,4.224,16.896,2016-02-18,0,2.93,-1.70
2/18/16 8:15 PM,4.218,16.872,2016-02-18,1,3.05,-1.70
2/18/16 8:30 PM,3.6,14.4,2016-02-18,2,3.18,-1.70
2/18/16 8:45 PM,3.054,12.216,2016-02-18,4,3.30,-1.70
2/18/16 9:00 PM,3.15,12.6,2016-02-18,0,3.30,-1.55
2/18/16 9:15 PM,2.958,11.832,2016-02-18,1,3.30,-1.40
2/18/16 9:30 PM,2.952,11.808,2016-02-18,2,3.30,-1.25
2/18/16 9:45 PM,3.12,12.48,2016-02-18,4,3.30,-1.10
2/18/16 10:00 PM,3.036,12.144,2016-02-18,0,3.30,-1.10
2/18/16 10:15 PM,2.862,11.448,2016-02-18,1,3.30,-1.10
2/18/16 10:30 PM,3.108,12.432,2016-02-18,2,3.30,-1.10
2/18/16 10:45 PM,3.972,15.888,2016-02-18,4,3.30,-1.10
2/18/16 11:00 PM,2.976,11.904,2016-02-18,0,3.30,-0.98
2/18/16 11:15 PM,2.964,11.856,2016-02-18,1,3.30,-0.85
2/18/16 11:30 PM,3.168,12.672,2016-02-18,2,3.30,-0.73
2/18/16 11:45 PM,3.162,12.648,2016-02-18,4,3.30,-0.60
2/19/16 12:00 AM,3,12,2016-02-19,0,3.30,-0.60
2/19/16 12:15 AM,2.97,11.88,2016-02-19,1,3.30,-0.60
2/19/16 12:30 AM,3.198,12.792,2016-02-19,2,3.85,-0.30
2/19/16 12:45 AM,3.096,12.384,2016-02-19,4,4.40,0.00
2/19/16 1:00 AM,2.94,11.76,2016-02-19,0,4.40,0.15
2/19/16 1:15 AM,3.126,12.504,2016-02-19,1,4.40,0.30
2/19/16 1:30 AM,3.066,12.264,2016-02-19,2,4.40,0.45
2/19/16 1:45 AM,3.066,12.264,2016-02-19,4,4.40,0.60
2/19/16 2:00 AM,2.886,11.544,2016-02-19,0,4.40,0.73
2/19/16 2:15 AM,3.228,12.912,2016-02-19,1,4.40,0.85
2/19/16 2:30 AM,3.132,12.528,2016-02-19,2,4.40,0.98
2/19/16 2:45 AM,2.934,11.736,2016-02-19,4,4.40,1.10
2/19/16 3:00 AM,3.096,12.384,2016-02-19,0,4.40,1.10
2/19/16 3:15 AM,3.12,12.48,2016-02-19,1,4.40,1.10
2/19/16 3:30 AM,3.072,12.288,2016-02-19,2,4.40,1.10
2/19/16 3:45 AM,2.832,11.328,2016-02-19,4,4.40,1.10
2/19/16 4:00 AM,3.204,12.816,2016-02-19,0,4.40,1.10
2/19/16 4:15 AM,3.108,12.432,2016-02-19,1,4.40,1.10
2/19/16 4:30 AM,3.006,12.024,2016-02-19,2,4.40,1.10
2/19/16 4:45 AM,3.036,12.144,2016-02-19,4,3.30,0.60
2/19/16 5:00 AM,3.168,12.672,2016-02-19,0,3.30,0.60
2/19/16 5:15 AM,3.108,12.432,2016-02-19,1,3.30,0.60
2/19/16 5:30 AM,2.904,11.616,2016-02-19,2,3.30,0.60
